Dimensão,Clique
12,"night, ooh, coven, surrounded, find, time, changed, recognise, eye, meet, soul, body"
12,"like, also, might, lie, soft, know, stone, inside, around, let, within, emotion"
12,"right, every, eye, watching, also, die, might, step, hunting, youre, love, take"
12,"like, also, might, dark, stone, inside, know, lie, remain, within, emotion, word"
13,"like, stillness, becomes, god, wondered, u, made, back, virgin, came, always, hunter, storm"
13,"like, also, might, god, wondered, made, u, back, always, came, virgin, hunter, storm"
13,"alone, love, stranger, lost, pleasure, hunting, killing, animal, im, make, concrete, jungle, helay"
13,"like, also, becomes, god, wondered, u, made, back, virgin, came, always, hunter, storm"
14,"like, peace, take, let, home, u, someone, live, come, place, coming, higher, mothership, world"
14,"lonely, day, side, might, walk, five, done, take, look, wonder, pain, think, away, life"
