Dimensão,Clique
3,"alone, made, might"
3,"mother, weve, would"
3,"warm, return, keep"
3,"heart, away, would"
3,"weight, boy, right"
3,"return, never, ah"
3,"weight, ah, never"
3,"youll, away, kind"
3,"like, oh, weve"
3,"kind, weve, hello"
3,"quiet, world, mind"
4,"collide, could, heart, give"
4,"like, boy, away, life"
4,"mother, take, would, u"
4,"pure, make, heart, ah"
4,"like, boy, away, hunter"
4,"mother, inside, could, light"
4,"collide, could, see, know"
4,"pure, let, know, peace"
4,"pure, let, inside, coming"
4,"pure, let, take, ah"
4,"collide, ooh, see, know"
4,"hoping, see, away, dont"
4,"deeper, die, love, walk"
4,"deeper, lyric, walk, love"
4,"keep, youll, home, time"
4,"become, animal, child, im"
4,"keep, sleep, peace, home"
4,"like, shes, lyric, moon"
4,"keep, forgetting, ooh, love"
4,"become, knew, im, child"
4,"child, mother, first, knew"
4,"like, shes, let, stone"
4,"like, shes, let, ever"
4,"demon, ever, might, contributorsall"
4,"ah, see, came, u"
4,"ah, see, moon, dream"
4,"like, ive, ever, inside"
4,"animal, im, first, feel"
4,"become, would, take, love"
4,"collide, ah, see, give"
4,"child, im, knew, first"
4,"victim, love, looking, soul"
4,"warm, love, make, hate"
4,"warm, love, inside, something"
4,"child, im, coming, world"
4,"return, make, moon, home"
4,"heart, knew, feel, living"
4,"heart, knew, cold, let"
4,"heart, shes, let, ever"
4,"heart, shes, let, stone"
4,"like, im, forced, die"
4,"heart, free, walk, dont"
4,"heart, drink, save, let"
4,"collide, ah, world, save"
4,"bring, stone, know, dont"
4,"warm, mother, ah, youre"
4,"warm, mother, light, inside"
4,"warm, knew, mother, youre"
4,"collide, ah, heart, give"
4,"collide, ah, see, world"
4,"heart, love, ive, hurt"
4,"heart, mother, would, u"
4,"never, youll, u, home"
4,"never, take, sleep, mother"
4,"never, take, sleep, home"
4,"collide, ah, see, know"
4,"ah, make, oh, world"
4,"mother, first, knew, inside"
4,"like, ترجمه‌ی, oh, let"
4,"child, take, coming, world"
4,"cold, knew, let, youre"
4,"right, every, quiet, love"
4,"like, make, moon, home"
4,"color, take, came, ah"
4,"quiet, would, hunter, storm"
4,"waiting, hello, let, home"
4,"waiting, hello, let, oh"
4,"color, dark, knew, moment"
4,"ooh, ’, lyric, walk"
4,"youll, there, living, love"
4,"youll, sleep, come, home"
4,"sleep, peace, home, waiting"
4,"sleep, make, oh, world"
4,"sleep, make, world, home"
4,"kind, hunter, u, would"
4,"contributorstranslationsespañolaurora, hello, oh, let"
4,"like, ground, word, around"
4,"kind, would, love, got"
4,"like, oh, every, take"
4,"kind, got, end, love"
4,"ooh, dont, see, know"
4,"ooh, dont, see, world"
4,"alone, love, make, ah"
4,"light, im, hate, love"
4,"color, would, could, see"
4,"ah, let, youre, cold"
4,"alone, ’, might, soul"
4,"there, living, love, step"
4,"upset, moon, lyric, shes"
4,"right, let, take, world"
4,"alone, ’, body, soul"
4,"body, skin, live, love"
4,"right, let, cant, eye"
5,"warm, knew, heart, mother, inside"
5,"warm, knew, make, heart, cold"
5,"demon, ’, lyric, let, might"
5,"like, live, love, u, take"
5,"like, im, love, living, step"
5,"like, im, oh, coming, world"
5,"animal, also, forced, around, die"
5,"like, looking, every, love, mind"
5,"like, live, love, know, word"
5,"demon, ’, need, let, greeting"
5,"need, know, ’, contributorsall, lyric"
5,"like, live, love, know, soul"
5,"like, live, love, soul, take"
5,"demon, ’, need, let, peace"
5,"like, live, skin, coming, time"
5,"return, make, youll, give, heart"
5,"like, first, im, eye, step"
5,"demon, ’, lyric, need, road"
5,"demon, ’, lyric, need, let"
5,"demon, ’, lyric, need, contributorsall"
5,"like, im, world, stranger, make"
5,"dreaming, mother, take, ah, oh"
5,"like, living, past, away, send"
5,"animal, cant, dont, love, eye"
5,"like, im, knew, make, world"
5,"dreaming, mother, waiting, peace, body"
5,"like, living, away, walk, dont"
5,"greeting, go, need, ’, let"
5,"like, coming, let, inside, time"
5,"dreaming, mother, take, ah, u"
5,"dreaming, soul, body, peace, waiting"
5,"dreaming, soul, body, peace, take"
5,"like, live, boy, let, world"
5,"like, ترجمه‌ی, lyric, free, let"
5,"animal, im, love, hate, make"
5,"warm, knew, met, inside, something"
5,"like, ترجمه‌ی, lyric, let, place"
5,"like, ترجمه‌ی, lyric, let, soft"
5,"like, also, might, moon, home"
5,"like, something, love, lyric, inside"
5,"like, also, might, dream, back"
5,"like, something, love, lyric, end"
5,"like, something, love, youre, end"
5,"36, need, dont, know, dream"
5,"like, jungle, hunting, let, youre"
5,"like, hate, make, love, im"
5,"like, get, see, mind, world"
5,"contributorstranslationsespañolaurora, hello, place, let, lyric"
5,"demon, take, let, eye, might"
5,"demon, take, ever, let, might"
5,"demon, take, old, road, might"
5,"contributorstranslationsespañolaurora, ترجمه‌ی, lyric, let, place"
5,"like, skin, inside, word, love"
5,"like, time, lyric, let, place"
5,"demon, take, side, road, peace"
5,"like, make, mind, u, love"
5,"contributorstranslationsespañolaurora, world, let, place, home"
5,"like, ترجمه‌ی, home, place, moon"
5,"like, also, go, road, take"
5,"animal, im, love, skin, eye"
5,"color, dark, know, heart, ah"
5,"animal, might, also, around, die"
5,"color, dark, know, heart, could"
5,"like, ground, foot, hunting, die"
5,"like, moment, dark, knew, inside"
5,"color, dark, shes, ah, heart"
5,"like, make, dark, moon, see"
5,"like, first, inside, soul, time"
5,"animal, im, world, stranger, make"
5,"like, place, might, home, moon"
5,"like, place, might, lyric, let"
5,"like, place, might, lyric, moon"
5,"like, girl, around, ground, foot"
5,"like, make, moon, love, mind"
5,"like, make, stranger, love, u"
5,"like, world, let, hunter, u"
5,"like, shes, free, lyric, let"
5,"like, ترجمه‌ی, home, place, let"
5,"like, world, see, dont, u"
5,"like, make, moon, see, mind"
5,"contributorsall, might, also, ever, inside"
5,"like, im, love, skin, eye"
5,"child, take, dont, soul, world"
5,"body, skin, live, coming, time"
5,"ah, let, around, free, dont"
5,"ah, let, take, world, oh"
5,"right, let, hunter, also, might"
5,"carry, ah, oh, save, boy"
5,"carry, ah, oh, weight, boy"
5,"carry, ah, know, save, around"
5,"carry, ah, know, save, dark"
5,"carry, ah, know, dont, around"
5,"ah, love, take, u, dont"
5,"ah, love, soul, dont, take"
5,"ah, see, make, world, u"
5,"ah, see, make, dark, moon"
5,"ah, see, give, make, u"
5,"ah, see, give, make, moon"
5,"ah, see, dont, u, world"
5,"look, side, ’, walk, ooh"
5,"look, side, ’, life, time"
5,"need, know, word, see, soft"
5,"look, side, take, ooh, walk"
5,"control, let, animal, time, know"
5,"become, take, youre, hunting, let"
5,"without, know, dont, time, inside"
5,"body, skin, love, light, eye"
5,"keep, call, love, inside, light"
5,"body, skin, love, light, inside"
5,"one, friend, could, take, world"
5,"contributorsall, ive, know, lyric, inside"
5,"call, might, also, end, love"
5,"call, might, also, dream, back"
5,"call, might, also, see, dream"
5,"light, inside, know, stone, love"
5,"different, dont, lyric, love, end"
5,"light, inside, call, love, stone"
5,"different, dont, u, take, love"
5,"light, im, love, skin, eye"
5,"different, dont, u, youll, love"
5,"different, dont, end, youll, love"
5,"light, see, know, soft, could"
5,"forgetting, love, end, lyric, dont"
5,"quiet, would, every, love, mind"
5,"ooh, dont, love, take, walk"
5,"kind, would, love, every, take"
5,"kind, would, u, love, take"
5,"kind, would, away, take, every"
5,"youll, end, forgetting, dont, love"
5,"youll, u, friend, home, make"
5,"youll, u, stranger, make, love"
5,"one, friend, might, could, take"
5,"youll, u, dont, feel, go"
5,"right, girl, hunting, let, boy"
5,"save, ive, lyric, girl, boy"
5,"look, side, take, time, life"
5,"shadow, might, call, dream, back"
5,"heart, knew, feel, let, inside"
5,"heart, free, dont, let, ah"
5,"mother, waiting, peace, let, oh"
5,"mother, save, oh, let, ah"
5,"mother, lyric, inside, save, let"
5,"30, lyric, im, dangerous, thing"
5,"fall, keep, inside, first, light"
5,"warm, mother, ah, inside, heart"
5,"heart, let, feel, dont, u"
5,"heart, love, moon, stone, inside"
5,"heart, love, ive, inside, know"
5,"heart, love, make, youll, u"
5,"heart, let, ah, u, mother"
5,"save, ive, lyric, inside, know"
5,"heart, love, dont, ah, u"
5,"shadow, might, call, dream, see"
5,"heart, let, ah, u, dont"
5,"collide, could, ever, world, save"
5,"warm, love, ah, youre, cold"
5,"like, peace, take, side, road"
5,"heart, love, would, u, hurt"
5,"child, im, knew, make, world"
5,"save, let, girl, lyric, boy"
5,"warm, love, end, abusive, there"
5,"heart, dark, stone, inside, moon"
5,"heart, dark, make, moon, ah"
5,"mother, inside, body, let, ah"
5,"save, let, inside, lyric, know"
5,"mother, take, let, ah, oh"
5,"heart, dark, ah, shes, moon"
5,"heart, dark, ah, inside, moon"
5,"like, peace, take, road, go"
5,"mother, take, let, ah, u"
6,"like, first, im, soul, eye, time"
6,"like, hurt, love, would, mind, u"
6,"like, hurt, love, walk, mind, u"
6,"like, hurt, love, walk, life, lyric"
6,"like, looking, soul, dont, love, eye"
6,"like, peace, take, side, time, life"
6,"isolation, make, helay, jungle, youll, love"
6,"like, looking, soul, dont, belong, eye"
6,"alone, love, im, soul, hunting, animal"
6,"like, tree, apple, wanting, ive, love"
6,"like, looking, every, eye, belong, dont"
6,"like, im, belong, dont, soul, anywhere"
6,"like, im, belong, dont, soul, eye"
6,"like, girl, boy, oh, let, world"
6,"find, greeting, go, ’, fine, need"
6,"like, girl, boy, let, hunting, lyric"
6,"beg, take, ah, came, throne, forgiveness"
6,"like, girl, boy, let, hunter, world"
6,"without, know, keep, time, inside, light"
6,"pure, guide, could, knew, ever, take"
6,"contributorsall, might, also, ’, lyric, know"
6,"look, side, take, might, friend, away"
6,"like, something, dangerous, end, thing, lyric"
6,"like, girl, could, let, world, knew"
6,"like, feel, knew, let, soft, inside"
6,"like, beautiful, oh, around, forced, world"
6,"like, beautiful, oh, around, mind, world"
6,"like, feel, dont, im, living, love"
6,"one, friend, ooh, home, world, take"
6,"like, hate, dont, soul, im, love"
6,"like, feel, dont, im, lyric, love"
6,"wonder, keep, without, know, life, love"
6,"like, get, toneca, let, omega, come"
6,"wonder, keep, without, know, ’, life"
6,"like, feel, dont, u, let, go"
6,"wonder, think, might, got, dont, away"
6,"savage, sigh, u, mother, ah, made"
6,"like, looking, every, eye, love, dont"
6,"like, looking, every, eye, love, watching"
6,"like, ترجمه‌ی, lyric, فارسی中文a, moon, soft"
6,"like, first, inside, skin, coming, time"
6,"right, every, away, might, also, take"
6,"right, every, away, might, also, hunter"
6,"like, feel, dont, im, living, moment"
6,"sword, away, cut, hunter, would, might"
6,"animal, im, love, hate, soul, dont"
6,"like, im, love, hunting, soul, eye"
6,"save, dark, emotion, could, inside, know"
6,"cut, also, might, seen, got, would"
6,"cut, also, might, away, hunter, would"
6,"mother, inside, body, let, coming, time"
6,"mother, take, let, youre, body, ah"
6,"mother, take, let, youre, body, eye"
6,"mother, waiting, peace, let, time, body"
6,"mother, lyric, inside, let, time, body"
6,"never, take, u, home, also, might"
6,"heart, love, dont, stone, inside, know"
6,"heart, love, dont, ah, inside, know"
6,"heart, love, dont, feel, youll, u"
6,"heart, love, dont, feel, inside, know"
6,"heart, let, stone, dont, inside, know"
6,"heart, let, ah, inside, dont, know"
6,"heart, let, ah, inside, mother, save"
6,"heart, let, feel, dont, inside, know"
6,"heart, could, know, let, inside, stone"
6,"heart, away, walk, mine, living, dont"
6,"heart, give, kiss, youll, make, u"
6,"heart, give, kiss, youll, make, past"
6,"heart, give, kiss, could, make, past"
6,"heart, dark, ah, inside, dont, know"
6,"heart, dark, save, could, know, inside"
6,"heart, dark, stone, inside, know, dont"
6,"heart, dark, stone, inside, know, could"
6,"heart, dark, stone, youve, seen, could"
6,"save, let, inside, around, know, emotion"
6,"save, let, inside, around, know, ah"
6,"anyone, home, toneca, let, omega, hello"
6,"throne, take, begs, forgiveness, came, ah"
6,"call, might, also, stone, inside, love"
6,"call, might, also, see, could, soft"
6,"heaven, hate, dont, end, got, know"
6,"ooh, dont, love, eye, soul, take"
6,"youll, u, friend, home, go, time"
6,"youll, u, dont, feel, forgetting, love"
6,"youll, helay, make, jungle, stranger, love"
6,"body, soul, love, inside, know, lyric"
6,"body, soul, love, youre, eye, take"
6,"body, soul, love, ooh, take, live"
6,"body, soul, love, ooh, lyric, know"
6,"body, soul, love, ooh, eye, take"
6,"body, soul, let, youre, eye, take"
6,"need, know, word, inside, lead, dark"
6,"ah, let, around, soul, dont, world"
6,"ah, let, body, soul, know, inside"
6,"ah, let, body, soul, youre, take"
6,"ah, let, u, dont, world, take"
6,"ah, love, soul, dont, inside, know"
6,"ah, love, soul, body, inside, know"
6,"mine, forgetting, youll, feel, love, dont"
6,"keep, know, body, soul, inside, love"
6,"keep, know, body, soul, inside, time"
6,"keep, know, body, light, inside, love"
6,"keep, know, body, light, inside, time"
6,"keep, know, hate, soul, inside, love"
6,"keep, first, body, light, inside, time"
6,"keep, first, soul, inside, time, body"
6,"ah, let, take, world, soul, dont"
6,"like, im, love, hunting, lyric, soul"
6,"need, know, word, inside, soft, go"
6,"need, know, ’, lyric, go, road"
6,"like, also, might, got, dont, away"
6,"like, also, might, got, would, love"
6,"like, also, might, take, could, back"
6,"like, also, might, see, away, dont"
6,"like, also, might, see, would, away"
6,"like, also, might, see, would, could"
6,"like, also, might, see, u, dont"
6,"like, also, might, see, u, came"
6,"like, also, might, hunter, u, let"
6,"like, also, might, foot, walk, life"
6,"like, also, might, foot, hunting, life"
6,"like, also, might, foot, hunting, die"
6,"like, also, might, around, die, every"
6,"like, also, might, stranger, love, u"
6,"like, time, lyric, life, ’, know"
6,"like, dangerous, youre, step, end, knew"
6,"like, make, emotion, see, could, soft"
6,"like, make, mind, u, see, world"
6,"like, make, knew, could, world, ever"
6,"like, make, knew, could, soft, emotion"
6,"like, make, home, friend, u, world"
6,"like, make, moon, see, soft, give"
6,"like, make, dark, could, see, emotion"
6,"like, im, time, dont, soul, lyric"
6,"like, im, time, dont, soul, eye"
6,"like, im, love, dont, soul, lyric"
6,"like, im, love, dont, soul, eye"
6,"like, also, might, mind, love, moon"
6,"like, also, knew, step, youre, end"
6,"like, also, knew, step, youre, take"
6,"like, also, knew, youre, let, take"
6,"need, know, dont, inside, ah, let"
6,"need, know, dont, see, soft, moment"
6,"need, know, peace, ’, go, let"
6,"cant, dont, love, every, eye, looking"
6,"dreaming, mother, take, peace, coming, body"
6,"dreaming, mother, made, ah, sigh, u"
6,"bring, stone, know, could, feed, light"
6,"contributorsanimal, lyric, soul, love, body, inside"
6,"animal, know, dont, hate, soul, love"
6,"animal, let, dont, cant, eye, go"
6,"animal, let, dont, ooh, soul, world"
6,"animal, around, dont, soul, world, let"
6,"animal, around, dont, soul, world, forced"
6,"need, know, ’, lyric, go, let"
6,"animal, im, world, ooh, soul, dont"
6,"animal, im, love, hunting, eye, soul"
6,"animal, contributorsanimal, lyric, soul, love, hunting"
6,"animal, contributorsanimal, lyric, soul, ooh, love"
6,"animal, contributorsanimal, lyric, soul, ooh, time"
6,"like, moment, soft, see, know, dont"
6,"like, think, might, away, got, dont"
6,"like, think, might, know, love, life"
6,"like, ive, lyric, know, life, love"
6,"like, ive, lyric, inside, know, love"
6,"like, world, let, take, could, friend"
6,"like, world, let, around, dont, soul"
6,"like, world, forced, around, soul, dont"
6,"like, also, go, let, friend, soft"
6,"animal, im, love, hunting, lyric, soul"
6,"alone, made, sigh, dreaming, mother, ah"
6,"like, girl, around, oh, let, world"
6,"demon, take, let, friend, home, might"
6,"warm, give, u, make, heart, ah"
6,"warm, made, u, mother, ah, savage"
6,"warm, made, u, mother, ah, heart"
6,"warm, full, heart, ah, made, mother"
6,"warm, full, heart, ah, spoon, mother"
6,"felt, divine, goddess, keep, step, shoulder"
6,"even, die, deeper, forced, around, animal"
6,"shadow, might, call, could, soft, see"
6,"recognise, ooh, time, greeting, go, let"
6,"color, dark, know, see, could, emotion"
6,"control, ’, know, also, let, might"
6,"control, love, keep, without, know, live"
6,"control, love, keep, without, know, life"
6,"control, love, without, might, know, life"
6,"demon, take, side, road, look, might"
6,"demon, ’, road, side, might, fine"
6,"demon, ’, road, side, look, might"
6,"become, knew, youre, mother, let, take"
6,"different, kind, human, end, youll, love"
6,"contributorstranslationsespañolaurora, hello, place, called, little, lyric"
6,"night, ooh, lyric, demon, ’, time"
6,"control, let, animal, know, also, might"
6,"control, love, know, might, also, animal"
6,"warm, knew, met, inside, fall, keep"
6,"control, love, know, might, also, life"
6,"control, love, hunting, life, also, might"
6,"demon, recognise, ooh, time, let, greeting"
6,"please, feed, know, bring, could, light"
6,"demon, ’, lyric, ooh, let, time"
6,"watch, would, mind, explode, hurt, u"
6,"demon, ’, friend, might, home, let"
6,"watch, would, mind, love, hurt, u"
6,"different, kind, human, u, love, youll"
6,"even, die, deeper, forced, im, animal"
6,"different, kind, human, u, love, take"
6,"child, might, dont, soul, take, eye"
6,"become, animal, hunting, let, helay, jungle"
6,"become, take, youre, hunting, killing, love"
6,"known, lyric, universe, inside, ive, contributorsall"
6,"child, could, knew, ever, guide, make"
6,"known, lyric, universe, inside, ive, save"
6,"warm, love, heart, ah, know, inside"
6,"warm, love, heart, ah, moon, inside"
6,"warm, love, u, make, heart, ah"
6,"child, would, could, ever, take, might"
6,"known, ever, universe, inside, ive, contributorsall"
6,"child, take, dont, soul, eye, time"
6,"child, take, eye, mother, coming, time"
6,"known, lyric, universe, wild, save, ive"
6,"become, animal, hunting, ho33embed, ho, 11"
7,"night, ooh, lyric, body, soul, contributorsanimal, time"
7,"like, im, love, hunting, step, die, eye"
7,"like, im, love, hunting, killing, pleasure, die"
7,"like, im, love, hunting, killing, eye, die"
7,"demon, ’, need, side, find, fine, greeting"
7,"like, hiding, dark, youve, shes, ever, seen"
7,"demon, ’, lyric, growing, road, old, might"
7,"night, ooh, lyric, body, soul, ’, time"
7,"demon, ’, lyric, growing, road, old, tired"
7,"demon, ’, lyric, growing, contributorsall, old, might"
7,"demon, ’, lyric, growing, contributorsall, old, tired"
7,"like, oohoohoohoohoohooh, moon, oohoohoohoohoohoohoohoohoohoohoohoohoohoohooh, oohoohoohoohoohoohoohoohooh, place, lyric"
7,"bone, take, beg, traded, clothes, ah, love"
7,"like, lead, dark, know, inside, lie, dont"
7,"demon, recognise, ooh, time, let, eye, peace"
7,"like, lake, give, kiss, make, last, u"
7,"ahahahahah, oohoohoohoohoohoohoohoohooh, oohoohoohoohoohooh, oohoohoohoohoohoohoohoohoohoohoohoohoohoohooh, moon, mind, see"
7,"like, lead, dark, know, see, dont, moment"
7,"like, thing, dangerous, knew, end, met, besides"
7,"like, glass, lake, make, kiss, last, u"
7,"like, lead, dark, know, see, dont, lie"
7,"child, might, dont, soul, belong, animal, eye"
7,"like, lead, dark, know, inside, moment, dont"
7,"heart, knew, could, ever, mother, guide, would"
7,"like, oohoohoohoohoohooh, moon, oohoohoohoohoohoohoohoohoohoohoohoohoohoohooh, فارسی中文a, place, lyric"
7,"child, might, dont, soul, belong, animal, anywhere"
7,"warm, knew, met, end, second, fall, there"
7,"demon, ’, friend, might, home, side, fine"
7,"recognise, ooh, time, greeting, go, changed, find"
7,"like, something, dangerous, end, thing, met, knew"
7,"like, something, dangerous, youre, met, end, knew"
7,"warm, love, heart, ah, moon, make, cold"
7,"ooh, dont, home, soul, take, let, world"
7,"ooh, peace, let, friend, home, world, take"
7,"demon, changed, friend, find, ooh, peace, time"
7,"child, im, animal, soul, dont, belong, anywhere"
7,"like, feel, dont, love, lyric, inside, know"
7,"warm, knew, met, end, second, abusive, there"
7,"like, feel, dont, soft, inside, know, moment"
7,"warm, knew, met, end, keep, fall, there"
7,"need, know, dont, inside, soft, feel, moment"
7,"like, feel, thing, dangerous, knew, inside, first"
7,"child, running, belong, animal, dont, soul, anywhere"
7,"heart, dark, guide, could, knew, ever, make"
7,"like, hate, dont, got, love, know, inside"
7,"heart, dark, knew, ever, could, save, inside"
7,"like, feel, thing, dangerous, lyric, danger, im"
7,"like, hiding, dark, youve, knew, seen, ever"
7,"like, ترجمه‌ی, lyric, فارسی中文a, moon, place, oohoohoohoohoohooh"
7,"home13embed, place, omega, let, home, anyone, hello"
7,"cant, dont, love, inside, feel, lyric, know"
7,"warm, love, end, keep, know, wonder, got"
7,"like, get, take, omega, coming, let, come"
7,"demon, take, let, eye, peace, ooh, time"
7,"like, hurt, love, walk, dont, feel, lyric"
7,"deep, inside, know, hate, dont, got, heaven"
7,"like, hate, dont, soul, im, forced, world"
7,"like, hate, dont, soul, im, forced, belong"
7,"warm, love, end, keep, know, hate, got"
7,"like, hate, dont, soul, inside, know, love"
7,"like, hate, dont, got, love, know, end"
7,"like, first, im, skin, eye, coming, time"
7,"like, make, dark, could, knew, ever, emotion"
7,"animal, know, dont, lyric, ooh, love, feel"
7,"color, dark, guide, could, emotion, ever, knew"
7,"like, also, might, belong, dont, eye, every"
7,"like, also, might, belong, dont, eye, soul"
7,"like, think, might, walk, take, love, dont"
7,"more2embed, becomes, wondered, came, stillness, always, back"
7,"like, also, might, got, would, seen, youve"
7,"like, think, might, walk, take, dont, away"
7,"like, also, might, got, would, weve, away"
7,"like, also, might, got, would, weve, youve"
7,"like, moment, soft, see, know, remain, unspoken"
7,"like, also, might, know, dream, like1embed, dont"
7,"like, think, might, walk, take, love, life"
7,"like, moment, soft, inside, remain, unspoken, know"
7,"like, also, might, take, life, love, hunting"
7,"like, also, might, take, away, dont, walk"
7,"like, also, might, take, could, friend, let"
7,"like, also, might, take, could, ever, let"
7,"like, also, might, take, every, love, would"
7,"like, also, might, take, every, away, dont"
7,"like, also, might, take, every, away, would"
7,"like, also, might, take, u, would, love"
7,"like, also, might, take, side, walk, road"
7,"like, also, might, take, side, friend, away"
7,"like, also, might, take, life, love, walk"
7,"like, also, might, take, side, friend, home"
7,"like, also, might, end, love, step, youre"
7,"like, also, might, ’, side, walk, road"
7,"like, world, let, take, could, ever, knew"
7,"like, world, let, take, dont, home, soul"
7,"like, also, go, fine, ’, friend, home"
7,"like, also, go, road, lyric, ’, know"
7,"like, also, go, let, ’, soul, home"
7,"like, also, go, let, ’, friend, home"
7,"carry, ah, oh, save, around, symphony, explosion"
7,"like, think, might, know, ’, side, road"
7,"like, think, might, know, ’, side, life"
7,"like, also, knew, could, ever, let, take"
7,"like, also, might, soft, friend, let, could"
7,"turning, inside, softer, ever, heart, save, dark"
7,"like, also, forced, around, soul, belong, dont"
7,"like, think, might, walk, ’, side, road"
7,"like, think, might, walk, ’, side, life"
7,"like, think, might, walk, take, side, road"
7,"like, also, might, mind, love, every, would"
7,"like, also, might, mind, love, u, would"
7,"like, also, might, mind, love, u, walk"
7,"like, also, might, ’, let, home, soul"
7,"like, also, might, ’, let, home, friend"
7,"like, also, might, ’, side, walk, life"
7,"ah, let, around, soul, dont, inside, know"
7,"like, make, dark, could, knew, ever, location"
7,"turning, lasted, dark, lead, ah, moment, know"
7,"animal, might, also, belong, dont, soul, eye"
7,"like, also, might, around, mind, anywhere, walk"
7,"like, also, might, around, dont, let, free"
7,"animal, im, love, dont, ooh, eye, soul"
7,"animal, im, love, dont, ooh, lyric, feel"
7,"animal, im, love, dont, ooh, lyric, soul"
7,"like, also, might, give, see, moon, soft"
7,"animal, im, love, hunting, die, killing, pleasure"
7,"animal, im, love, hunting, die, killing, eye"
7,"animal, im, time, lyric, ooh, soul, dont"
7,"animal, im, time, ooh, eye, soul, dont"
7,"like, also, might, around, mind, anywhere, every"
7,"animal, also, forced, around, soul, belong, dont"
7,"animal, around, dont, soul, running, belong, anywhere"
7,"night, ooh, coven, contributorsanimal, body, soul, time"
7,"like, also, might, dark, see, moon, word"
7,"youll, past, make, stranger, kiss, give, friend"
7,"contributorstranslationsespañolaurora, ترجمه‌ی, 20, place, home13embed, let, home"
7,"animal, cant, dont, love, feel, lyric, know"
7,"like, make, last, u, friend, give, kiss"
7,"like, make, stranger, see, friend, world, u"
7,"like, make, stranger, see, friend, world, could"
7,"animal, know, dont, lyric, ooh, love, soul"
7,"animal, also, go, dont, soul, let, eye"
7,"like, also, might, take, die, love, walk"
7,"like, also, might, free, lyric, dont, let"
7,"like, also, might, hunter, away, would, every"
7,"animal, might, also, love, hunting, lyric, soul"
7,"36, like1embed, might, also, dream, know, dont"
7,"like, also, might, see, dream, know, dont"
7,"like, also, might, see, soft, moon, word"
7,"like, also, might, see, soft, moon, going"
7,"animal, might, also, love, dont, soul, eye"
7,"animal, might, also, love, dont, stone, know"
7,"please, bigger, see, bring, know, could, light"
7,"animal, might, also, let, soul, eye, dont"
7,"like, also, might, lyric, know, life, love"
7,"like, also, might, free, lyric, dont, walk"
