Dimensão,Clique
3,"started, someone, 12"
3,"ever, board, member"
3,"ever, trying, mistake"
3,"wearing, much, right"
3,"government, life, time"
3,"yes, insecurity, moment"
3,"blow, ’, got"
3,"like, learn, risk"
3,"there, real, relationship"
3,"tour, keep, knowing"
3,"simple, isnt, time"
3,"leave, grow, gut"
3,"address, get, better"
3,"tour, sound, know"
3,"yes, way, important"
3,"hair, u, year"
3,"soul, put, body"
3,"there, call, person"
3,"thats, —, maybe"
3,"hang, time, college"
3,"whether, everything, feel"
3,"memory, way, youve"
3,"whether, everything, there"
3,"find, mom, fight"
3,"address, post, turn"
3,"yes, told, —"
3,"yes, turn, important"
3,"hang, back, time"
3,"thats, learn, time"
3,"completely, arena, lesson"
3,"never, mom, there"
3,"cant, situation, later"
3,"cant, realizing, example"
3,"amazing, 15, would"
3,"picture, dont, isnt"
3,"go, pop, might"
3,"started, someone, got"
3,"first, especially, could"
3,"first, especially, year"
3,"time, telling, see"
3,"go, forever, sometimes"
3,"internet, many, relationship"
3,"comment, together, keep"
3,"mean, think, alive"
3,"guess, ’, whatever"
3,"especially, twenty, year"
3,"case, doctor, hope"
3,"update, friend, school"
3,"ever, maybe, forever"
3,"theyve, theyre, need"
3,"theyve, coming, conversation"
3,"mean, lot, new"
3,"ive, country, tell"
3,"serious, lesson, mom"
3,"especially, take, really"
3,"advice, every, interviewer"
3,"tour, new, part"
3,"breathing, grow, know"
3,"time, included, every"
3,"everyone, time, person"
3,"trouble, new, lot"
3,"mom, parent, word"
3,"member, music, loved"
3,"career, losing, tell"
3,"mom, everything, thank"
3,"ive, alternative, songwriter"
3,"call, would, word"
3,"time, laugh, also"
3,"path, say, make"
3,"canceled, career, life"
3,"acceptance, want, people"
3,"probably, whatever, might"
3,"advice, year, music"
3,"could, bully, see"
3,"perspective, write, get"
3,"kid, night, thought"
3,"take, many, risk"
3,"kid, place, still"
3,"take, incredible, really"
3,"always, behind, thought"
3,"like, work, went"
3,"time, taylor, cool"
3,"like, swift, lyric"
3,"like, swift, let"
3,"high, day, one"
3,"lonely, room, time"
3,"fine, learn, say"
3,"canceled, getting, theyre"
3,"thats, right, time"
3,"time, music, tell"
3,"leave, desire, sometimes"
3,"society, time, woman"
3,"getting, free, career"
3,"song, writing, video"
3,"like, dancing, taylor"
3,"time, told, moment"
3,"failure, normal, idea"
3,"artist, miserable, tonight"
3,"thats, always, youll"
3,"thats, always, time"
3,"cant, perfect, ex"
3,"song, fantasy, say"
3,"time, veiled, actually"
3,"ive, see, three"
3,"go, tour, standing"
3,"time, perfect, get"
3,"part, proud, new"
3,"show, something, love"
3,"order, there, everything"
3,"hope, free, way"
3,"hope, especially, proud"
3,"game, relationship, award"
3,"today, nyu, york"
3,"mom, made, car"
3,"fantasy, college, got"
3,"miserable, make, way"
3,"picture, want, acceptance"
3,"mistake, perfect, idea"
3,"year, right, turn"
3,"11, weird, made"
3,"may, get, trying"
3,"may, grow, america"
3,"found, friend, know"
3,"brain, im, excuse"
3,"internet, social, lesson"
3,"like, nyu, went"
3,"little, lesson, body"
3,"ill, later, back"
3,"may, get, way"
3,"posted, know, friend"
3,"mistake, didnt, going"
3,"date, one, single"
3,"album, making, thank"
3,"youll, behind, reason"
3,"face, start, break"
3,"year, needed, person"
3,"experience, nyu, life"
3,"youll, arent, youre"
3,"first, hope, theyre"
3,"constantly, message, music"
3,"upon, know, ive"
3,"year, say, 29"
3,"think, didnt, —"
3,"may, feel, way"
3,"experience, bully, got"
3,"walked, love, people"
3,"tape, wall, along"
3,"room, id, new"
3,"manchester, 2015, vega"
3,"grow, trust, relationship"
3,"choice, next, give"
3,"true, time, oh"
3,"choice, u, long"
3,"grow, important, learn"
3,"fighting, love, real"
3,"who, taylor, im"
3,"like, sound, went"
3,"found, know, hope"
3,"interviewer, one, music"
3,"year, music, teen"
3,"bill, board, many"
3,"found, new, lot"
3,"perfectly, create, didnt"
3,"grow, someone, enough"
3,"15, many, much"
3,"fighting, reason, there"
3,"like, taylor, im"
3,"absolutely, told, time"
3,"3, normal, time"
3,"apology, would, relationship"
3,"warning, time, room"
3,"mistake, failure, feel"
3,"comment, back, someone"
3,"teacher, today, incredible"
3,"award, 1, thing"
3,"incredible, new, brit"
3,"incredible, would, room"
3,"million, know, feel"
3,"something, acceptance, people"
3,"experience, normal, trial"
3,"comment, back, get"
3,"even, music, tell"
3,"situation, voice, lesson"
3,"friendship, foot, heavy"
3,"stadium, year, part"
3,"write, story, song"
3,"stigma, culture, come"
3,"please, theyve, love"
3,"bully, ex, maybe"
3,"stadium, one, people"
3,"upon, every, person"
3,"mistake, chance, trying"
3,"warning, society, constantly"
3,"warning, time, music"
3,"hole, command, way"
3,"fear, lesson, scar"
3,"first, hope, arent"
3,"experience, think, really"
3,"experience, think, best"
3,"face, step, back"
3,"face, step, u"
3,"last, dancing, want"
3,"experience, global, know"
3,"forgive, making, id"
3,"choice, school, people"
3,"posted, girl, thought"
3,"face, needed, person"
3,"face, needed, much"
3,"fear, led, life"
3,"playing, lesson, arena"
3,"meet, grass, love"
3,"raised, life, get"
3,"nothing, easy, 9"
3,"like, teen, sleeping"
3,"think, —, u"
3,"future, u, get"
3,"school, work, every"
4,"choice, life, stranger, love"
4,"hear, hard, life, path"
4,"picture, right, love, thought"
4,"picture, dont, wanted, friend"
4,"excuse, make, ex, right"
4,"hear, come, want, give"
4,"hear, might, life, youre"
4,"choice, make, love, every"
4,"hear, needed, song, even"
4,"hear, come, want, u"
4,"hear, song, say, even"
4,"hear, song, say, life"
4,"laughing, thing, fun, keep"
4,"choice, school, right, make"
4,"especially, part, life, much"
4,"4, youre, searching, new"
4,"choice, able, place, know"
4,"matter, live, someone, try"
4,"especially, part, mess, life"
4,"hear, might, life, need"
4,"hear, might, even, need"
4,"hear, today, hard, u"
4,"find, right, say, fight"
4,"hear, today, youre, might"
4,"find, back, right, step"
4,"hear, today, say, youre"
4,"hear, today, could, u"
4,"hear, someone, dream, proof"
4,"find, right, say, look"
4,"tease, dont, way, feel"
4,"address, every, next, try"
4,"picture, back, cut, want"
4,"youll, step, right, u"
4,"never, brain, life, always"
4,"youll, maybe, u, learn"
4,"constantly, every, room, lesson"
4,"meet, fantasy, ’, say"
4,"meet, fantasy, ’, love"
4,"chance, losing, trying, one"
4,"chance, happy, there, life"
4,"friendship, lifelong, twenty, lesson"
4,"first, theyre, thing, time"
4,"friendship, life, especially, twenty"
4,"first, everything, time, woman"
4,"negativity, youre, say, mean"
4,"never, much, many, youve"
4,"round, year, body, lesson"
4,"worst, thing, young, life"
4,"worst, take, life, time"
4,"youll, step, right, find"
4,"first, never, heavy, life"
4,"youll, step, way, lesson"
4,"like, youre, gut, news"
4,"write, way, felt, people"
4,"write, way, felt, alone"
4,"write, way, song, get"
4,"like, many, put, night"
4,"write, way, song, alone"
4,"write, way, u, alone"
4,"write, think, didnt, people"
4,"write, think, didnt, really"
4,"like, needed, felt, help"
4,"never, one, who, many"
4,"issue, life, put, living"
4,"like, sound, might, im"
4,"issue, life, important, felt"
4,"youll, thing, u, learn"
4,"youll, thing, find, right"
4,"first, 25, lesson, people"
4,"first, 25, lesson, year"
4,"youll, thing, said, different"
4,"never, much, thank, got"
4,"mean, little, lesson, tell"
4,"mean, think, ’, lot"
4,"song, let, get, say"
4,"always, wanted, twenty, people"
4,"never, incredible, would, im"
4,"always, u, believed, people"
4,"always, u, 10, lot"
4,"worked, tell, hard, every"
4,"worked, tell, little, hard"
4,"canceled, im, time, losing"
4,"worked, tell, way, every"
4,"please, lesson, safe, life"
4,"canceled, im, internet, losing"
4,"please, lesson, left, term"
4,"fix, tell, far, mind"
4,"head, im, internet, need"
4,"head, im, learned, one"
4,"fix, day, every, could"
4,"fix, really, mind, far"
4,"like, dancing, outfit, leotard"
4,"song, work, im, let"
4,"song, work, im, way"
4,"song, would, love, college"
4,"first, lesson, call, 15"
4,"first, lesson, friendship, life"
4,"bizarre, time, isnt, achieve"
4,"never, opinion, there, life"
4,"never, hammered, dont, foot"
4,"address, get, way, enough"
4,"address, get, way, home"
4,"differently, different, know, situation"
4,"picture, dont, thought, love"
4,"address, feel, important, living"
4,"address, feel, ive, felt"
4,"address, feel, ive, enough"
4,"address, feel, enough, way"
4,"never, little, always, brain"
4,"song, 22, love, im"
4,"song, home, way, get"
4,"ill, know, three, next"
4,"song, needed, music, even"
4,"address, feel, hit, eat"
4,"differently, different, reason, voice"
4,"forget, time, learn, lesson"
4,"choice, cool, place, many"
4,"different, thing, best, youre"
4,"different, friend, think, best"
4,"different, friend, type, know"
4,"different, friend, youre, best"
4,"different, situation, u, tell"
4,"amazing, many, people, everything"
4,"experience, ever, idea, mistake"
4,"amazing, thank, year, last"
4,"experience, ever, perfectly, one"
4,"go, news, ooh, dont"
4,"someday, youre, people, might"
4,"responsibility, use, want, im"
4,"lot, system, lesson, time"
4,"lot, system, lesson, want"
4,"lot, 10, want, u"
4,"lot, tonight, u, people"
4,"lot, tonight, room, time"
4,"lot, voice, think, u"
4,"lot, think, u, people"
4,"lot, think, u, ’"
4,"experience, ever, ive, bully"
4,"go, say, guess, ’"
4,"go, news, leave, youre"
4,"go, situation, solicited, might"
4,"advice, give, said, dont"
4,"tour, stadium, face, front"
4,"advice, give, said, moment"
4,"tour, know, people, world"
4,"tour, everything, people, know"
4,"tour, everything, visuals, video"
4,"post, keep, every, way"
4,"post, home, way, friend"
4,"advice, every, ever, said"
4,"different, thing, every, best"
4,"post, home, ive, id"
4,"heavy, try, ive, life"
4,"advice, every, try, unsolicited"
4,"experience, see, think, dont"
4,"whoa, life, blow, ’"
4,"experience, would, case, want"
4,"advice, every, person, said"
4,"support, even, theyre, music"
4,"go, guess, ’, got"
4,"go, situation, might, tell"
4,"post, im, id, ive"
4,"wasnt, told, u, —"
4,"go, singing, perspective, oftentimes"
4,"go, singing, made, oftentimes"
4,"year, sleeping, feel, twenty"
4,"year, help, someone, 30"
4,"year, help, big, even"
4,"year, still, even, want"
4,"year, still, want, feel"
4,"year, last, 15, know"
4,"searching, world, try, new"
4,"10, ive, want, thank"
4,"better, together, feel, one"
4,"year, lesson, feel, twenty"
4,"true, finding, thought, learned"
4,"cathartic, one, person, making"
4,"still, thing, 30, 1"
4,"still, important, turn, alone"
4,"still, songwriter, might, way"
4,"think, didnt, really, hurt"
4,"think, need, dont, people"
4,"think, need, dont, ’"
4,"think, need, dont, im"
4,"think, many, idea, people"
4,"cathartic, song, would, emergency"
4,"year, lesson, even, big"
4,"year, lesson, body, every"
4,"year, age, 29, feel"
4,"pain, try, way, address"
4,"pain, feel, hit, address"
4,"saying, one, choose, someone"
4,"playing, wembley, empire, year"
4,"playing, lesson, year, turn"
4,"year, taken, someone, every"
4,"experience, high, one, want"
4,"go, college, got, never"
4,"go, college, really, learned"
4,"go, ill, guess, say"
4,"year, say, put, even"
4,"year, say, big, even"
4,"year, part, feel, much"
4,"pain, feel, better, address"
4,"pain, feel, way, address"
4,"year, person, every, coming"
4,"year, person, every, young"
4,"year, person, young, age"
4,"year, person, coming, know"
4,"experience, thing, mistake, idea"
4,"year, online, every, someone"
4,"tour, stadium, fan, pulled"
4,"tour, stadium, fan, time"
4,"happy, yeah, love, way"
4,"tour, new, people, world"
4,"miserable, night, make, time"
4,"wall, would, id, even"
4,"wall, thing, id, even"
4,"simple, choose, learned, ive"
4,"simple, choose, learned, someone"
4,"simple, choose, drama, ive"
4,"simple, isnt, someone, learned"
4,"simple, life, drama, ive"
4,"simple, life, someone, learning"
4,"miserable, happy, there, way"
4,"simple, life, someone, learned"
4,"fantasy, ’, look, love"
4,"wisdom, situation, u, know"
4,"wisdom, situation, u, tell"
4,"mom, fight, lesson, tell"
4,"mom, else, tell, lesson"
4,"wisdom, thing, whatever, right"
4,"cringe, live, wrong, try"
4,"social, learned, coming, lesson"
4,"singing, music, country, made"
4,"along, way, take, really"
4,"term, might, time, im"
4,"term, might, even, im"
4,"next, searching, take, try"
4,"choice, cool, place, love"
4,"term, lesson, every, time"
4,"woman, year, age, young"
4,"woman, year, want, u"
4,"woman, say, tell, way"
4,"woman, say, tell, want"
4,"woman, age, people, young"
4,"woman, age, people, arent"
4,"least, type, want, friend"
4,"woman, age, message, young"
4,"least, paper, would, thank"
4,"least, paper, friend, type"
4,"least, paper, friend, thank"
4,"least, one, making, need"
4,"term, lesson, left, coming"
4,"album, year, thank, amazing"
4,"term, lesson, im, coming"
4,"term, lesson, im, even"
4,"album, ive, three, world"
4,"next, every, try, world"
4,"term, lesson, cringe, even"
4,"cringe, look, retrospectively, even"
4,"differently, different, tell, situation"
4,"bleachella, youre, look, one"
4,"free, im, way, say"
4,"dream, someone, fear, life"
4,"take, lesson, make, trust"
4,"dream, someone, read, sometimes"
4,"take, lesson, stress, time"
4,"take, advantage, trust, life"
4,"take, help, someone, also"
4,"take, also, time, learn"
4,"dream, internet, sometimes, right"
4,"dream, internet, need, people"
4,"dream, someone, fear, sometimes"
4,"dream, internet, need, right"
4,"take, try, easy, make"
4,"dream, lot, love, people"
4,"experience, wanted, high, one"
4,"led, gut, know, youre"
4,"advice, give, unsolicited, room"
4,"happy, get, time, life"
4,"happy, life, stranger, love"
4,"happy, life, best, way"
4,"tour, date, people, world"
4,"take, credit, way, work"
4,"advice, person, dont, said"
4,"dream, someone, story, love"
4,"dream, career, internet, need"
4,"free, im, way, thing"
4,"free, youre, say, way"
4,"advice, music, tell, anyone"
4,"realized, use, ive, want"
4,"free, youre, thing, come"
4,"realized, thing, actually, want"
4,"realized, thing, actually, made"
4,"free, youre, path, time"
4,"advice, music, tell, executive"
4,"advice, decade, warning, room"
4,"cringe, look, learn, probably"
4,"kid, want, u, cool"
4,"kid, who, never, many"
4,"take, new, twenty, make"
4,"take, new, twenty, searching"
4,"take, new, try, make"
4,"take, new, try, searching"
4,"experienced, right, love, life"
4,"take, risk, help, try"
4,"take, lesson, even, easy"
4,"take, lesson, hurt, trust"
4,"cringe, look, even, might"
4,"like, teen, way, myspace"
4,"never, year, normal, feel"
4,"like, child, world, every"
4,"sometimes, call, internet, im"
4,"sometimes, important, really, feel"
4,"like, u, step, moment"
4,"like, u, voice, word"
4,"like, u, voice, im"
4,"ever, would, unless, around"
4,"going, im, use, want"
4,"like, got, ex, thing"
4,"ever, would, didnt, mistake"
4,"going, im, say, big"
4,"ever, news, one, said"
4,"going, young, didnt, people"
4,"leg, 2015, 5th, 7th"
4,"ever, home, —, post"
4,"today, singing, loved, would"
4,"today, incredible, new, proud"
4,"ever, every, someone, online"
4,"probably, learn, look, learned"
4,"like, keep, know, didnt"
4,"today, one, feel, class"
4,"probably, learn, forget, time"
4,"sometimes, thing, reason, youre"
4,"sometimes, thing, reason, thought"
4,"ever, would, ive, pop"
4,"sometimes, thing, im, internet"
4,"ever, said, dont, maybe"
4,"ever, said, one, maybe"
4,"ever, idea, —, one"
4,"accepting, lesson, work, really"
4,"ever, hard, today, u"
4,"ever, tell, hard, u"
4,"feeling, felt, life, keep"
4,"like, trust, back, make"
4,"like, trust, lesson, make"
4,"like, paper, type, would"
4,"knew, wish, life, get"
4,"ever, led, u, people"
4,"sometimes, focus, let, dont"
4,"sometimes, relationship, there, dont"
4,"sometimes, relationship, there, anyway"
4,"like, put, night, whole"
4,"sometimes, relationship, dont, youre"
4,"sometimes, relationship, anyway, internet"
4,"like, got ta, yeah, thing"
4,"sometimes, phase, know, grow"
4,"ever, equal, happy, mistake"
4,"sometimes, thing, there, reason"
4,"sometimes, together, feel, reason"
4,"ever, maybe, family, life"
4,"probably, youre, free, time"
4,"like, give, anyone, much"
4,"failing, 3, normal, trying"
4,"like, work, eat, let"
4,"could, someone, help, know"
4,"happened, know, one, changed"
4,"happened, know, something, year"
4,"283, feel, still, ive"
4,"could, someone, see, absolutely"
4,"heart, perfect, feel, time"
4,"order, good, witnessed, faith"
4,"like, —, laugh, want"
4,"met, youre, something, let"
4,"like, making, know, type"
4,"could, would, u, happen"
4,"order, common, know, get"
4,"perspective, write, really, didnt"
4,"like, feel, eat, maybe"
4,"perspective, time, music, didnt"
4,"order, alive, make, feel"
4,"order, time, miserable, make"
4,"order, time, feel, mean"
4,"order, time, feel, live"
4,"failing, feel, one, moment"
4,"could, someone, love, story"
4,"could, situation, tell, u"
4,"failing, step, moment, feel"
4,"today, word, find, thing"
4,"knew, love, girli, get"
4,"today, hard, perfectionist, know"
4,"like, telling, voice, im"
4,"today, hard, thing, might"
4,"like, help, big, im"
4,"today, way, find, say"
4,"like, ’, got, much"
4,"knew, much, give, life"
4,"today, let, feel, class"
4,"today, enough, way, feel"
4,"deep, breathe, breathing, enough"
4,"deep, feel, know, could"
4,"today, new, friend, youre"
4,"probably, youre, learned, look"
4,"probably, youre, searching, new"
4,"probably, youre, youll, right"
4,"like, left, lesson, body"
4,"like, idea, model, one"
4,"like, pop, would, country"
4,"indebted, love, much, u"
4,"5th, 2015, usa, august"
4,"deep, feel, enough, perfect"
4,"cant, focus, dont, sometimes"
4,"cant, focus, dont, ive"
4,"case, maybe, lesson, youll"
4,"12, lesson, really, work"
4,"12, lesson, turn, life"
4,"12, song, love, life"
4,"may, feel, sometimes, time"
4,"may, feel, normal, time"
4,"may, get, sometimes, time"
4,"emergency, needed, unless, person"
4,"may, 2015, america, 30th"
4,"ill, knowing, keep, life"
4,"canada, 2015, 6th, 5th"
4,"canada, 2015, 7th, 5th"
4,"canada, 2015, 10th, 8th"
4,"canada, 2015, july, washington"
4,"tabloid, sport, every, spectator"
4,"knowing, thing, life, part"
4,"face, love, put, ’"
4,"knowing, chapter, life, part"
4,"eliminate, phone, lesson, isnt"
4,"face, love, put, people"
4,"face, love, dont, night"
4,"ill, unless, around, ever"
4,"live, try, best, anyone"
4,"live, try, right, time"
4,"live, feel, ive, time"
4,"live, feel, alive, love"
4,"mistake, thing, idea, around"
4,"mistake, thing, message, make"
4,"mistake, thing, around, ive"
4,"mistake, thing, grow, make"
4,"mistake, forever, grow, would"
4,"found, always, wanted, twenty"
4,"found, make, time, ive"
4,"ill, know, finding, lot"
4,"talking, im, graduating, life"
4,"supposed, everything, know, time"
4,"ill, unless, around, want"
4,"supposed, everything, u, woman"
4,"supposed, thing, time, woman"
4,"supposed, thing, time, know"
4,"talking, nyu, graduating, life"
4,"wished, curliest, straight, hair"
4,"live, room, every, time"
4,"live, room, every, someone"
4,"live, room, discerning, someone"
4,"ill, tell, lot, never"
4,"live, learn, hard, time"
4,"live, learn, ive, time"
4,"supposed, everything, u, know"
4,"touch, perfect, enough, deep"
4,"breed, cat, needed, got"
4,"face, love, every, person"
4,"stadium, im, face, looking"
4,"cant, anything, look, ive"
4,"stadium, im, part, looking"
4,"cant, thank, know, wan na"
4,"cant, thank, ever, ive"
4,"case, unless, dont, want"
4,"stadium, one, part, im"
4,"cant, perfect, way, felt"
4,"cant, realizing, lesson, way"
4,"cant, reaction, much, heart"
4,"cant, ex, thing, right"
4,"case, would, today, u"
4,"cant, word, ever, thank"
4,"cant, enough, word, ever"
4,"cant, done, thank, really"
4,"cant, done, thank, much"
4,"cant, even, living, lesson"
4,"cant, even, year, put"
4,"cant, even, help, try"
4,"cant, even, really, done"
4,"case, would, relationship, lesson"
4,"case, opinion, lesson, learned"
4,"cant, really, songwriter, way"
4,"oftentimes, critical, perspective, feel"
4,"cant, help, felt, try"
4,"cant, college, dont, experience"
4,"face, back, dont, ’"
4,"structure, every, lose, thing"
4,"older, interviewer, member, meant"
4,"fan, pulled, one, stadium"
4,"cant, life, grab, much"
4,"face, say, put, ’"
4,"whatever, thing, right, want"
4,"face, say, put, people"
4,"whatever, thing, learn, want"
4,"whatever, picture, want, right"
4,"cant, help, know, try"
4,"fan, stadium, im, one"
4,"hole, im, id, would"
4,"fan, year, music, much"
4,"fan, year, much, thank"
4,"sure, im, would, song"
4,"fan, thank, paper, friend"
4,"fan, million, fear, safe"
4,"jail, idea, thing, around"
4,"fan, music, much, love"
4,"fan, music, love, one"
4,"fan, going, safe, put"
4,"fan, stadium, year, last"
4,"like, feel, ex, maybe"
4,"oftentimes, indepth, singing, made"
4,"hang, would, —, want"
4,"avoid, try, make, back"
4,"whether, relationship, one, would"
4,"doctor, work, want, know"
4,"doctor, type, know, making"
4,"whether, relationship, one, there"
4,"house, get, trying, thing"
4,"normal, year, really, learned"
4,"normal, feel, really, one"
4,"normal, feel, class, one"
4,"normal, feel, class, time"
4,"thinly, veiled, see, want"
4,"like, learn, u, maybe"
4,"normal, college, class, one"
4,"normal, trying, wanted, one"
4,"thinly, veiled, advice, want"
4,"never, working, love, lesson"
4,"goal, tonight, people, everything"
4,"goal, would, people, say"
4,"goal, would, people, room"
4,"goal, would, even, say"
4,"goal, would, even, room"
4,"whether, relationship, there, opinion"
4,"avoid, try, excuse, make"
4,"avoid, trust, back, make"
4,"whether, right, thing, feel"
4,"lonely, feel, uhuh, yeah"
4,"lonely, feel, time, yeah"
4,"hope, know, love, day"
4,"hope, know, work, way"
4,"hope, know, work, maybe"
4,"hope, know, maybe, life"
4,"hope, arent, u, love"
4,"directing, everything, visuals, video"
4,"sit, felt, still, ive"
4,"sit, felt, still, alone"
4,"never, heavy, got, something"
4,"problem, real, everything, people"
4,"far, really, way, work"
4,"artist, room, get, there"
4,"society, message, young, woman"
4,"like, try, best, anyone"
4,"realizing, 18, lesson, feel"
4,"realizing, 18, still, feel"
4,"artist, take, good, make"
4,"artist, take, new, make"
4,"whether, right, would, feel"
4,"whether, right, thing, internet"
4,"per, se, school, got"
4,"never, anything, say, ive"
4,"like, thank, paper, would"
4,"stop, people, youre, lesson"
4,"unsolicited, next, try, every"
4,"unsolicited, next, year, every"
4,"like, nyu, might, group"
4,"like, nyu, might, life"
4,"accomplishment, try, credit, dont"
4,"grow, someone, take, make"
4,"grow, would, happen, u"
4,"grow, would, u, make"
4,"grow, would, u, know"
4,"grow, would, relationship, forever"
4,"like, nyu, making, life"
4,"grow, would, perfect, enough"
4,"grow, take, learn, make"
4,"like, friend, loved, one"
4,"like, friend, make, new"
4,"like, friend, girl, way"
4,"like, friend, type, best"
4,"write, there, get, room"
4,"write, would, really, didnt"
4,"write, would, instagram, situation"
4,"like, friend, paper, type"
4,"like, friend, paper, thank"
4,"grow, take, trust, make"
4,"lonely, feel, way, yeah"
4,"snake, calling, people, started"
4,"never, even, say, anything"
4,"never, new, youve, many"
4,"think, voice, u, im"
4,"bully, want, school, people"
4,"bully, want, u, year"
4,"bully, want, u, come"
4,"never, year, still, feel"
4,"like, new, single, life"
4,"never, searching, forget, lesson"
4,"never, find, say, thank"
4,"never, way, songwriter, still"
4,"never, even, year, still"
4,"never, word, anything, recorded"
4,"never, word, able, recorded"
4,"fear, speak, million, feel"
4,"fear, put, greatest, mean"
4,"like, learned, message, loud"
4,"never, lot, new, people"
4,"never, family, mom, thank"
4,"never, take, searching, new"
4,"hard, u, choice, know"
4,"hard, life, thing, anyway"
4,"never, always, example, dont"
4,"like, learned, loud, one"
4,"like, child, make, every"
4,"lonely, feel, sleeping, yeah"
4,"focus, people, dont, ive"
4,"internet, thing, u, im"
4,"internet, need, people, think"
4,"internet, think, u, people"
4,"internet, think, u, im"
4,"instead, one, changed, album"
4,"could, instagram, story, situation"
4,"who, one, cool, many"
4,"opinion, stock, there, learned"
4,"opinion, let, lesson, know"
4,"opinion, let, place, know"
4,"opinion, life, there, learned"
4,"opinion, life, choice, friendship"
4,"like, feel, one, reading"
4,"something, every, young, year"
4,"something, every, year, put"
4,"something, mean, think, ’"
4,"11, ive, lesson, would"
4,"something, learning, ive, life"
4,"something, whole, one, youre"
4,"something, come, youre, see"
4,"martin, want, woman, year"
4,"internet, thing, u, people"
4,"internet, thing, need, im"
4,"internet, thing, need, right"
4,"internet, thing, need, people"
4,"could, easy, lesson, make"
4,"hang, would, want, even"
4,"hang, still, want, even"
4,"could, part, especially, much"
4,"yes, way, id, made"
4,"yes, way, teen, myspace"
4,"could, something, dont, fear"
4,"internet, many, people, think"
4,"internet, many, people, thing"
4,"could, knowing, part, thing"
4,"something, young, twenty, year"
4,"internet, would, lesson, happen"
4,"internet, would, lesson, people"
4,"internet, would, lesson, thought"
4,"internet, would, u, people"
4,"internet, would, u, happen"
4,"internet, losing, thing, im"
4,"internet, thing, lesson, happen"
4,"internet, thing, lesson, weird"
4,"internet, thing, lesson, im"
4,"internet, thing, lesson, people"
4,"internet, thing, lesson, thought"
4,"internet, would, lesson, relationship"
4,"something, soul, let, time"
4,"something, put, know, year"
4,"something, heavy, life, friendship"
4,"like, told, didnt, —"
4,"like, told, laugh, someone"
4,"like, told, laugh, —"
4,"like, told, u, someone"
4,"like, told, u, —"
4,"like, told, u, easy"
4,"like, loud, one, reason"
