Dimensão,Clique
6,"like, learn, made, look, actually, world"
6,"inward, look, learn, actually, made, world"
6,"like, learn, simulation, made, also, look"
6,"fix, day, every, work, accepting, body"
6,"fix, body, accepting, work, quick, dangerous"
6,"fix, body, accepting, work, quick, every"
6,"like, learn, lesson, important, maybe, life"
6,"like, learn, lesson, important, approval, seeker"
6,"like, learn, lesson, important, value, seeker"
6,"fix, person, someone, could, tell, every"
6,"twonovember, 2015, 7th, leg, usaasia, singapore"
6,"hear, might, life, hard, inevitably, nyu"
6,"hear, today, hard, graduating, nyu, might"
6,"nh, got, needed, support, help, even"
6,"nh, got, key, even, support, help"
6,"like, wan na, family, would, life, know"
6,"like, spectator, world, life, every, love"
6,"like, barb, day, included, slight, one"
6,"like, barb, day, included, slight, every"
6,"like, woah, ooh, news, got ta, bad"
6,"like, woah, ooh, news, got ta, yeah"
6,"like, woah, ooh, news, dont, yeah"
6,"nh, got, key, worker, help, support"
6,"like, however, life, give, tell, dont"
6,"nh, got, key, worker, tonight, support"
6,"like, bazillion, question, work, moon, eat"
6,"like, bazillion, question, work, moon, asked"
6,"like, bazillion, question, work, world, asked"
6,"like, see, weasel, telling, someone, look"
6,"journalist, piece, indepth, oftentimes, write, critical"
6,"like, young, perfect, way, felt, make"
6,"like, young, every, thing, way, life"
6,"like, young, every, thing, way, make"
6,"like, young, every, felt, way, life"
6,"like, young, every, felt, way, make"
6,"like, york, im, say, let, world"
6,"offembed, dreamsenchantedout, woodsshake, getting, togetherwildest, back"
6,"like, york, one, done, youve, say"
6,"journalist, perspective, singing, write, indepth, oftentimes"
6,"journalist, perspective, singing, write, indepth, anyone"
6,"like, bad, thing, day, start, every"
6,"like, see, dont, laugh, someone, want"
6,"journalist, perspective, critical, oftentimes, indepth, write"
6,"like, see, dont, laugh, ’, want"
6,"journalist, perspective, singing, write, didnt, anyone"
6,"hear, might, life, hard, inevitably, misspeak"
6,"offembed, dreamsenchantedout, woodsshake, 1, togetherwildest, contributor1989"
6,"like, wan na, say, im, anyone, would"
6,"affect, issue, daytoday, saw, many, life"
6,"affect, bill, system, branch, signing, government"
6,"affect, bill, daytoday, life, many, saw"
6,"affect, bill, daytoday, life, signing, saw"
6,"affect, bill, daytoday, life, signing, government"
6,"like, try, know, dressed, 2012, phase"
6,"like, try, know, help, im, someone"
6,"affect, bill, daytoday, branch, signing, government"
6,"minnesota, september, usa, 2015, indianapolis, 16th"
6,"overwhelmed, get, good, always, life, perspective"
6,"hour, however, okay, darkest, disappear, life"
6,"hour, someone, support, darkest, life, need"
6,"hour, someone, support, darkest, theyre, need"
6,"hour, someone, support, lowest, theyre, need"
6,"13yearold, place, car, cry, made, roster"
6,"13yearold, place, music, country, made, roster"
6,"13yearold, place, music, country, listened, roster"
6,"like, wan na, say, im, anyone, let"
6,"full, conversation, theyre, cat, theyve, walked"
6,"offembed, dreamsenchantedout, woodsshake, 1, world, contributor1989"
6,"13yearold, way, cry, car, made, roster"
6,"like, wan na, u, know, dont, im"
6,"like, wan na, u, know, dont, ’"
6,"offembed, dreamsenchantedout, woodsshake, 1, togetherwildest, back"
6,"like, wan na, u, know, would, im"
6,"like, phase, know, maybe, life, dont"
6,"like, imagine, covid, test, thousand, pas"
6,"like, imagine, covid, test, thousand, idea"
6,"like, hiding, im, thing, advocate, big"
6,"like, hiding, im, say, advocate, big"
6,"13yearold, place, music, country, listened, housewife"
6,"13yearold, place, music, cry, made, roster"
6,"like, thank, brit, anyone, wan na, would"
6,"like, thank, brit, anyone, wan na, best"
6,"like, thank, brit, anyone, much, would"
6,"like, unwittingly, see, telling, someone, look"
6,"like, child, bazillion, question, asked, moon"
6,"like, child, bazillion, question, asked, world"
6,"like, child, make, would, didnt, message"
6,"like, friend, im, lesson, way, make"
6,"like, youre, friend, life, best, way"
6,"like, youre, friend, thank, wan na, know"
6,"like, youre, friend, thank, people, new"
6,"like, youre, ahh, friend, party, jumping"
6,"like, youre, ahh, friend, best, jumping"
6,"like, friend, family, wan na, know, thank"
6,"like, friend, family, wan na, know, life"
6,"like, hack, give, however, life, one"
6,"like, hack, give, however, life, wish"
6,"like, optimist, really, im, consummate, lose"
6,"like, treat, love, life, sport, spectator"
6,"like, youre, brit, thank, best, wan na"
6,"like, seems, one, night, place, crowded"
6,"like, seems, one, night, ew, anyway"
6,"like, seems, one, night, ew, ditch"
6,"like, seems, one, thing, also, might"
6,"like, seems, one, swift, ew, anyway"
6,"like, seems, hiding, advocate, thing, big"
6,"like, youre, friend, life, best, wan na"
6,"like, snake—only, someone, bite, back, step"
6,"like, snake—only, gut, strike, know, back"
6,"like, punished, island, siren, silence, went"
6,"like, punished, island, lived, silence, went"
6,"like, taylor, ew, swift, anyway, uhuh"
6,"like, taylor, ew, swift, anyway, seems"
6,"like, treat, love, life, world, spectator"
6,"like, snake—only, someone, bite, lesson, step"
6,"like, moisturize, every, start, skin, nicer"
6,"like, teen, would, message, myspace, —"
6,"like, many, crucial, wont, moment, give"
6,"like, youre, whole, learned, one, also"
6,"like, sound, folk, might, alternative, songwriter"
6,"like, youre, say, new, people, life"
6,"like, sound, folk, might, centric, songwriter"
6,"like, youre, say, new, people, let"
6,"like, youre, say, new, people, thank"
6,"like, sound, might, line, centric, songwriter"
6,"like, sound, knowledge, wine, type, know"
6,"like, sound, type, consummate, wine, know"
6,"like, sound, wine, optimist, consummate, know"
6,"like, cry, silence, went, siren, whyd"
6,"like, cry, silence, went, siren, punished"
6,"like, cry, love, way, ’, dont"
6,"like, cry, went, break, whyd, siren"
6,"like, needed, felt, start, skin, nicer"
6,"like, needed, felt, start, eyeliner, sharpie"
6,"like, needed, felt, start, eyeliner, nicer"
6,"like, youre, friend, life, know, party"
6,"like, many, everything, people, know, life"
6,"like, many, everything, youve, much, done"
6,"like, many, uhuh, place, crowded, night"
6,"like, many, vulnerable, put, citizen, risk"
6,"like, youre, friend, life, new, people"
6,"like, many, crucial, wont, moment, know"
6,"like, many, one, night, place, crowded"
6,"like, youre, say, tell, dont, let"
6,"like, youre, say, know, thank, wan na"
6,"like, outfit, would, much, comfortable, leotard"
6,"like, outfit, would, much, comfortable, say"
6,"like, needed, moisturize, start, skin, nicer"
6,"like, needed, felt, using, sharpie, eyeliner"
6,"like, many, one, thing, —, idea"
6,"like, moisturize, every, night, skin, put"
6,"like, moisturize, every, night, skin, nicer"
6,"like, moisturize, every, night, body, put"
6,"like, dancing, keep, together, let, day"
6,"like, grass, salad, didnt, —, maybe"
6,"like, grass, one, single, reading, model"
6,"like, grass, one, didnt, —, maybe"
6,"like, ohohohoh, twentytwo, keep, alright, dancing"
6,"like, ohohohoh, twentytwo, keep, oh, dancing"
6,"like, video, love, much, thank, everything"
6,"like, video, annie, lennox, thousand, surprise"
6,"like, video, annie, lennox, thousand, body"
6,"like, video, annie, lennox, left, body"
6,"like, birthday, ahh, friend, jumping, party"
6,"like, new, say, york, thank, world"
6,"like, birthday, surprise, thousand, lennox, video"
6,"like, new, say, york, let, world"
6,"like, birthday, surprise, thousand, party, video"
6,"like, new, say, people, world, thank"
6,"like, new, say, people, world, let"
6,"like, thank, u, would, know, word"
6,"like, thank, u, would, know, wan na"
6,"twonovember, 2015, 7th, leg, november, singapore"
6,"twonovember, 2015, 7th, 8th, november, singapore"
6,"homeschool, work, school, grade, 10th, went"
6,"show, lyric, last, lipsyncing, got, caught"
6,"like, learned, pimms, easy, make, cocktail"
6,"show, taking, got, caught, last, lipsyncing"
6,"show, taking, got, caught, mother, something"
6,"show, need, expect, theyve, still, love"
6,"like, thank, thing, know, u, word"
6,"show, need, seen, still, love, theyve"
6,"nevada, bossier, may, usa, 20th, 2015"
6,"like, new, say, proud, youve, done"
6,"show, taking, got, caught, last, something"
6,"like, dancing, keep, together, let, class"
6,"like, dancing, keep, twentytwo, everything, alright"
6,"like, dancing, keep, twentytwo, everything, might"
6,"like, interview, every, felt, model, role"
6,"like, interview, every, felt, slight, included"
6,"like, interview, one, included, slight, barb"
6,"like, sport, life, love, single, one"
6,"like, oh, night, love, yeah, dont"
6,"like, oh, lived, fight, also, might"
6,"like, interview, every, felt, model, included"
6,"like, youre, thing, reason, back, oh"
6,"like, oh, twentytwo, know, yeah, dont"
6,"like, oh, twentytwo, night, yeah, dont"
6,"like, nyu, making, thank, waiting, id"
6,"like, nyu, making, thank, technically, id"
6,"like, nyu, making, thank, technically, paper"
6,"like, nyu, york, thank, id, waiting"
6,"like, youre, thing, reason, back, one"
6,"like, young, people, together, hurl, group"
6,"like, interview, every, barb, slight, included"
6,"like, youre, thing, lyric, way, look"
6,"like, dancing, keep, twentytwo, might, oh"
6,"like, dancing, keep, want, everything, alright"
6,"like, dancing, keep, 222embed, class, 91"
6,"like, learned, lesson, isnt, someone, actually"
6,"like, dancing, keep, 222embed, class, let"
6,"like, dancing, also, twentytwo, might, oh"
6,"like, youre, thing, also, learned, 1"
6,"like, dancing, also, twentytwo, might, everything"
6,"like, learned, lesson, change, make, someone"
6,"like, youre, see, dont, ’, wan na"
6,"like, learned, lesson, want, 9, dont"
6,"like, youre, see, dont, ’, want"
6,"like, youre, see, dont, lesson, let"
6,"like, youre, see, dont, wan na, let"
6,"like, dancing, contributorstranslationsespañolportuguês22, 91, 222embed, class"
6,"like, young, people, idea, thing, want"
6,"like, young, people, life, way, felt"
6,"like, young, people, life, way, say"
6,"kid, always, adult, even, insecurity, popular"
6,"kid, always, 30, tell, little, mom"
6,"like, feel, one, night, love, yeah"
6,"like, feel, one, night, sleepin, wont"
6,"like, feel, one, night, sleepin, look"
6,"kid, always, never, example, popular, insecurity"
6,"kid, always, never, rectifying, example, popular"
6,"kid, always, never, even, still, insecurity"
6,"kid, always, never, even, still, tell"
6,"kid, always, never, even, popular, insecurity"
6,"kid, always, never, even, punish, would"
6,"like, feel, one, reason, together, back"
6,"like, feel, one, reason, thing, back"
6,"kid, always, never, even, punish, tell"
6,"like, feel, one, know, together, day"
6,"kid, always, never, little, mom, tell"
6,"kid, always, never, little, punish, would"
6,"experienced, guy, exactly, life, past, love"
6,"experienced, guy, exactly, four, last, point"
6,"experienced, guy, year, last, four, point"
6,"experienced, right, point, last, four, year"
6,"allowed, tell, u, message, arent, woman"
6,"allowed, tell, age, impossible, meet, arent"
6,"kid, always, adult, even, insecurity, still"
6,"allowed, tell, age, impossible, meet, ive"
6,"allowed, tell, age, message, arent, woman"
6,"allowed, standard, impossible, age, meet, arent"
6,"allowed, standard, impossible, age, meet, ive"
6,"allowed, standard, impossible, age, woman, arent"
6,"kid, working, never, example, popular, rectifying"
6,"kid, always, never, little, punish, tell"
6,"allowed, tell, age, impossible, woman, arent"
6,"experienced, guy, exactly, life, past, point"
6,"kid, misbehaving, punish, never, tell, even"
6,"like, feel, one, weird, thing, moment"
6,"like, feel, perceived, made, critical, piece"
6,"floor, work, homeschool, education, airport, terminal"
6,"floor, work, homeschool, went, airport, terminal"
6,"floor, work, road, airport, went, terminal"
6,"bridge, emergency, needed, cathartic, person, section"
6,"bridge, emergency, needed, name, person, section"
6,"aaron, thank, dessner, people, album, made"
6,"like, feel, fun, thing, ex, make"
6,"like, feel, fun, uhuh, make, ex"
6,"like, feel, fun, uhuh, make, night"
6,"like, feel, lyric, way, thing, look"
6,"like, feel, lyric, night, contributorstranslationsespañolportuguês22, perfect"
6,"aaron, thank, dessner, jack, antonoff, joe"
6,"aaron, thank, creative, people, album, made"
6,"realized, lock, fiveyearold, couldnt, forgive, room"
6,"realized, messaging, veiled, actually, leader, want"
6,"realized, thinly, veiled, messaging, leader, want"
6,"like, feel, one, weird, thing, lesson"
6,"kid, misbehaving, punish, never, tell, little"
6,"kid, misbehaving, punish, never, would, even"
6,"kid, misbehaving, punish, never, would, little"
6,"realized, responsibility, actually, messaging, leader, want"
6,"realized, responsibility, actually, use, influence, leader"
6,"like, feel, one, weird, would, lesson"
6,"realized, responsibility, actually, use, influence, disgusting"
6,"realized, thing, feel, couldnt, forgive, fiveyearold"
6,"realized, thing, feel, ive, forgive, fiveyearold"
6,"realized, thing, feel, ive, made, mistake"
6,"realized, thing, feel, ive, made, fiveyearold"
6,"like, feel, one, made, thing, day"
6,"realized, thing, room, couldnt, forgive, fiveyearold"
6,"realized, responsibility, actually, use, want, leader"
6,"like, feel, one, know, twentytwo, wont"
6,"experienced, guy, exactly, life, last, point"
6,"british, vancouver, usa, 4th, august, 2015"
6,"like, feel, way, made, felt, people"
6,"tried, someone, concept, best, explain, every"
6,"tried, someone, try, live, right, wrong"
6,"like, feel, way, important, felt, life"
6,"tried, someone, try, live, best, wrong"
6,"like, feel, way, important, lesson, life"
6,"like, feel, way, felt, make, perfect"
6,"supported, today, student, friend, one, loved"
6,"supported, today, student, pursuit, loved, one"
6,"supported, today, student, pursuit, educational, one"
6,"supported, today, ally, friend, one, loved"
6,"emotional, care, wellbeing, music, pulled, one"
6,"emotional, part, one, pulled, stadium, reputation"
6,"emotional, part, one, pulled, music, reputation"
6,"emotional, part, one, pulled, music, wellbeing"
6,"outweigh, many, room, relationship, one, toxic"
6,"outweigh, many, wonderful, relationship, simple, toxic"
6,"like, feel, make, change, lesson, someone"
6,"like, feel, make, speak, someone, change"
6,"like, feel, make, felt, speak, would"
6,"seeing, dusting, want, still, laugh, experience"
6,"seeing, dusting, want, still, back, hang"
6,"outweigh, there, room, one, toxic, relationship"
6,"like, feel, word, reading, voice, hearing"
6,"like, feel, perfect, make, would, love"
6,"outweigh, many, wonderful, get, joy, simple"
6,"like, feel, uhuh, perfect, make, ex"
6,"like, feel, uhuh, yeah, love, night"
6,"outweigh, many, wonderful, relationship, one, toxic"
6,"outweigh, many, wonderful, relationship, simple, joy"
6,"like, feel, way, love, perfect, make"
6,"like, feel, perfect, make, felt, would"
6,"like, feel, word, reading, subject, hearing"
6,"like, feel, word, reading, subject, jamil"
6,"like, feel, word, reason, hearing, voice"
6,"like, feel, group, family, maybe, chosen"
6,"like, feel, group, family, together, know"
6,"like, feel, group, family, together, chosen"
6,"like, feel, group, people, maybe, know"
6,"like, feel, group, people, maybe, chosen"
6,"like, feel, group, people, together, know"
6,"like, feel, group, family, maybe, know"
6,"like, feel, group, people, together, hurl"
6,"like, feel, step, make, back, someone"
6,"like, feel, step, make, lesson, let"
6,"british, love, grateful, indebted, fan, much"
6,"british, love, grateful, indebted, fan, one"
6,"british, love, grateful, indebted, cool, one"
6,"british, love, grateful, everything, much, fan"
6,"like, feel, group, people, together, chosen"
6,"floor, work, homeschool, education, airport, finished"
6,"british, love, youve, fan, much, everything"
6,"like, feel, family, life, would, know"
6,"like, feel, living, look, also, im"
6,"tried, insanely, best, explain, every, concept"
6,"lady, contribute, young, regret, worst, life"
6,"like, feel, living, lesson, life, important"
6,"lady, contribute, young, polite, worst, life"
6,"lady, contribute, young, polite, raised, born"
6,"like, feel, family, life, maybe, know"
6,"lady, contribute, young, polite, raised, life"
6,"lady, may, born, raised, young, polite"
6,"michigan, usa, 2015, june, detroit, 2nd"
6,"michigan, usa, 2015, june, detroit, 30th"
6,"michigan, usa, 2015, june, louisville, 2nd"
6,"michigan, usa, 2015, may, detroit, 30th"
6,"british, 1st, usa, august, vancouver, 2015"
6,"lady, contribute, someone, worst, regret, life"
6,"like, feel, let, together, know, people"
6,"floor, work, homeschool, education, grade, finished"
6,"like, feel, perceived, made, living, weird"
6,"least, technically, paper, making, nyu, thank"
6,"least, technically, paper, making, type, doctor"
6,"like, cup, pimms, oldfashioneds, spritz, aperol"
6,"columbia, canada, august, edmonton, 4th, 2015"
6,"bush, playing, shepherd, year, 15, empire"
6,"bush, playing, shepherd, year, 15, last"
6,"stage, want, thank, producer, coexecutive, mostly"
6,"stage, want, thank, see, collaborator, honor"
6,"stage, want, thank, see, collaborator, mostly"
6,"stage, want, thank, see, coexecutive, mostly"
6,"stage, performing, standing, love, connected, everything"
6,"stage, craft, connected, everything, love, performing"
6,"like, cup, pimms, cocktail, easy, make"
6,"like, cup, pimms, cocktail, easy, aperol"
6,"justin, jon, marcus, national, mumford, vernon"
6,"like, cup, pimms, cocktail, spritz, aperol"
6,"like, vulnerable, felt, citizen, risk, speak"
6,"like, world, know, im, let, say"
6,"like, world, know, im, work, want"
6,"like, world, know, im, work, let"
6,"like, world, know, im, work, way"
6,"like, world, know, day, work, let"
6,"like, world, know, people, work, want"
6,"least, technically, paper, making, nyu, doctor"
6,"like, world, know, people, work, let"
6,"justin, joe, antonoff, marcus, national, vernon"
6,"justin, joe, mumford, marcus, national, vernon"
6,"like, world, know, people, say, let"
6,"like, world, every, love, put, life"
6,"like, world, made, way, people, look"
6,"like, vulnerable, felt, citizen, risk, put"
6,"like, world, know, people, work, way"
6,"like, world, anyone, im, say, let"
6,"least, expect, show, need, still, moment"
6,"least, expect, show, need, still, love"
6,"like, young, people, life, way, thing"
6,"like, young, people, life, want, say"
6,"like, young, people, life, want, thing"
6,"like, squirm, make, fun, thing, u"
6,"journalist, perspective, singing, music, didnt, anyone"
6,"like, gut, back, trust, strike, know"
6,"like, strike, know, someone, dont, back"
6,"differently, different, instagram, voice, write, situation"
6,"differently, today, know, thing, youre, youll"
6,"without, feel, people, realizing, still, might"
6,"playful, picture, experimentation, back, look, dont"
6,"playful, fashion, dont, keep, lesson, 21"
6,"playful, fashion, dont, experimentation, look, back"
6,"playful, fashion, dont, experimentation, look, 21"
6,"playful, fashion, dont, experimentation, lesson, 21"
6,"playful, fashion, memory, lesson, 21, keep"
6,"like, break, say, dont, much, ’"
6,"least, expect, show, need, funny, moment"
6,"least, expect, show, slyly, moment, funny"
6,"least, expect, selfaware, moment, funny, slyly"
6,"like, skin, every, felt, start, nicer"
6,"least, one, people, wanted, friend, trying"
6,"least, one, people, want, love, would"
6,"like, message, u, loved, —, would"
6,"least, one, people, moment, need, still"
6,"least, thank, want, people, would, love"
6,"china, shanghai, november, 2015, singapore, 10th"
6,"china, shanghai, november, 2015, 10th, 11th"
6,"playful, fashion, memory, lesson, 21, experimentation"
6,"like, break, say, dont, want, get"
6,"like, break, say, dont, much, im"
6,"least, funny, honest, moment, selfaware, slyly"
6,"justin, joe, antonoff, jack, national, vernon"
6,"like, place, wish, get, know, life"
6,"justin, joe, antonoff, jack, thank, dessner"
6,"simple, bullying, ive, experience, laugh, learning"
6,"like, feel, amongst, reason, voice, hearing"
6,"simple, bullying, petty, someone, laugh, learning"
6,"simple, bullying, petty, someone, disarming, learned"
6,"simple, bullying, petty, someone, disarming, learning"
6,"simple, bullying, petty, experience, learning, laugh"
6,"simple, number, cruel, isnt, phone, setting"
6,"simple, number, cruel, isnt, blocking, setting"
6,"simple, number, cruel, isnt, blocking, unresolvable"
6,"kansa, september, usa, 2015, ohio, 21st"
6,"wisdom, choice, come, right, u, know"
6,"wisdom, situation, whatever, impart, tell, might"
6,"like, feel, 91, lyric, contributorstranslationsespañolportuguês22, perfect"
6,"like, feel, party, know, crucial, moment"
6,"like, feel, crucial, moment, wont, know"
6,"like, feel, crucial, moment, really, important"
6,"like, feel, crucial, moment, really, know"
6,"floor, radio, airport, road, went, terminal"
6,"like, feel, much, love, would, youve"
6,"wisdom, thing, whatever, might, tell, impart"
6,"wisdom, thing, whatever, might, tell, helped"
6,"wisdom, thing, helped, tell, far, might"
6,"like, feel, much, love, day, lesson"
6,"simple, phone, eliminate, setting, drama, choose"
6,"wisdom, situation, whatever, impart, solicited, officially"
6,"like, feel, much, anyone, im, would"
6,"like, feel, dress, perfect, lyric, night"
6,"like, feel, dress, perfect, make, night"
6,"like, feel, dress, perfect, make, ex"
6,"like, feel, dress, fun, make, night"
6,"like, feel, dress, fun, make, ex"
6,"wisdom, situation, whatever, impart, solicited, might"
6,"like, feel, real, lesson, life, important"
6,"simple, phone, eliminate, setting, drama, cruel"
6,"simple, phone, eliminate, setting, isnt, cruel"
6,"like, id, im, thing, advocate, big"
6,"totally, dont, news, said, earlier, terrifying"
6,"totally, dont, news, said, earlier, ever"
6,"totally, dont, news, said, good, terrifying"
6,"totally, dont, offer, earlier, said, ever"
6,"ho, im, think, morning, nine, coffee"
6,"like, id, im, thing, big, lesson"
6,"ho, im, think, morning, nine, need"
6,"like, id, im, say, advocate, big"
6,"ho, im, hole, nine, die, need"
6,"ho, im, hole, nine, die, coffee"
6,"ho, im, hole, nine, morning, need"
6,"ho, im, hole, nine, morning, coffee"
6,"justin, joe, antonoff, jack, thank, vernon"
6,"like, id, im, say, big, shouldnt"
6,"like, feel, perceived, made, living, piece"
6,"like, id, im, thing, big, shouldnt"
6,"blew, afterglow, lyric, thing, italianaafterglow, traduzione"
6,"simple, laugh, ive, come, experience, learning"
6,"like, every, put, tell, life, felt"
6,"relief, theyre, app, countdown, hope, getting"
6,"relief, bit, app, countdown, getting, hope"
6,"relief, bit, tiny, found, always, ive"
6,"relief, bit, tiny, found, always, hope"
6,"blew, afterglow, lyric, thing, italianaafterglow, youre"
6,"relief, bit, tiny, found, getting, hope"
6,"like, every, day, lesson, thing, love"
6,"like, every, day, lesson, thing, keep"
6,"like, every, day, lesson, work, body"
6,"zoom, pandemic, dorm, locked, class, essentially"
6,"zoom, pandemic, dorm, locked, class, college"
6,"blew, swift, italianaafterglow, lyric, traduzione, afterglow"
6,"relief, bit, tiny, countdown, hope, getting"
6,"go, lip, girl, list, look, way"
6,"go, world, im, anyone, say, want"
6,"thats, gift, —, hang, laugh, want"
6,"shame, losing, fight, one, chance, remove"
6,"fact, life, know, wan na, throne, maisie"
6,"fact, life, know, people, led, many"
6,"fact, life, present, maisie, wan na, throne"
6,"fact, jumped, many, people, board, internet"
6,"attack, oh, reason, thought, fighting, back"
6,"nothing, dont, contributorsain ’, go, look, way"
6,"shame, losing, fight, one, ego, remove"
6,"attack, oh, reason, thought, behind, back"
6,"nothing, dont, contributorsain ’, go, 8, way"
6,"nothing, lyric, ’ bout, laugh, way, look"
6,"nothing, lyric, ’ bout, contributorsain ’, afterglow66embed, 8"
6,"nothing, lyric, ’ bout, contributorsain ’, way, look"
6,"nothing, lyric, ’ bout, contributorsain ’, way, 8"
6,"nothing, really, someone, take, hurt, matter"
6,"12th, 2015, usa, north, october, carolina"
6,"fact, jumped, many, people, board, led"
6,"12th, 2015, usa, philadelphia, june, carolina"
6,"read, someone, taught, story, absolutely, proof"
6,"12th, 2015, usa, nebraska, fargo, october"
6,"andrew, faculty, fleming, hamilton, provost, katherine"
6,"12th, 2015, usa, pennsylvania, june, philadelphia"
6,"gratitude, find, way, express, step, misstep"
6,"gratitude, find, way, express, step, youll"
6,"gratitude, find, way, express, hope, youll"
6,"12th, 2015, usa, omaha, nebraska, october"
6,"12th, 2015, australiaembed, 2, melbourne, contributors1"
6,"played, torturer, ’, look, mean, fantasy"
6,"zoe, video, griff, ed, anyone, selena"
6,"nothing, dont, contributorsalbum, 9, meembed, something"
6,"nothing, dont, ’, meet, go, see"
6,"leave, school, path, framework, chart, structure"
6,"leave, school, thing, structure, framework, chart"
6,"leave, school, thing, structure, framework, gain"
6,"nothing, dont, ’, go, thought, love"
6,"talk, way, tease, think, ’, see"
6,"nothing, dont, ’, walk, way, love"
6,"decide, uncle, started, fund, hedge, got"
6,"decide, uncle, started, fund, hedge, hold"
6,"decide, uncle, started, fund, let, hold"
6,"shame, there, chance, remove, losing, one"
6,"nothing, dont, ’, walk, way, kiss"
6,"talk, way, make, feel, alive, drive"
6,"education, high, school, grade, 10th, finished"
6,"12th, 2015, australiaembed, 2, melbourne, december"
6,"newer, idea, one, thought, plot, better"
6,"nothing, dont, ’, there, way, walk"
