Dimensão,Clique
6,"unresolvable, feel, cruel, isnt, blocking, number"
6,"never, togetherwildest, back, getting, dreamsenchantedout, ever"
6,"manchester, arena, bombing, fear, 7, biggest"
6,"cathartic, one, folklore, evermore, unique, making"
6,"manchester, arena, lesson, 7, biggest, fear"
6,"energy, hurting, give, someone, life, discerning"
6,"cathartic, one, folklore, evermore, unique, extraordinary"
6,"bos, type, email, home, friend, best"
6,"sure, im, work, main, song, rеason"
6,"sure, im, work, main, 90, world"
6,"manchester, arena, bombing, shooting, vega, concert"
6,"good, take, searching, especially, risk, try"
6,"responsibility, use, influence, disgusting, rhetoric, actually"
6,"sure, im, work, improve, world, 90"
6,"tеll, love, tell, ’, thing, hurt"
6,"somewhere, write, ticket, get, song, would"
6,"whether, consensus, right, internet, would, general"
6,"unresolvable, feel, way, blocking, pain, number"
6,"energy, u, push, think, lot, boundary"
6,"manchester, arena, bombing, fear, vega, concert"
6,"tеll, love, tell, ’, cut, hurt"
6,"flex, would, sure, weird, internet, call"
6,"tеll, love, tell, picture, hurt, cut"
6,"flex, would, lesson, internet, weird, call"
6,"sure, weird, call, pretty, internet, would"
6,"whether, relationship, would, internet, consensus, general"
6,"enthusiasm, thing, hiding, advocate, im, big"
6,"responsibility, use, influence, disgusting, rhetoric, im"
6,"manchester, arena, bombing, fear, vega, biggest"
6,"sure, im, work, main, 90, rеason"
6,"sure, im, becausе, main, rеason, song"
6,"bos, type, email, different, best, friend"
6,"bos, type, email, different, best, send"
6,"eagerness, culture, unbothered, ambivalence, perpetuates, outlook"
6,"fame, undercut, take, success, accomplishment, credit"
6,"eagerness, culture, unbothered, false, around, stigma"
6,"fame, focus, work, take, credit, accomplishment"
6,"never, family, would, ive, thank, know"
6,"whether, relationship, viewed, affected, stranger, general"
6,"face, say, dont, get, let, people"
6,"never, even, always, well, tell, still"
6,"manchester, 24th, june, 2015, england, scotland"
6,"manchester, 24th, june, 2015, england, 27th"
6,"fame, focus, work, dont, people, let"
6,"enthusiasm, thing, hiding, stigma, seems, false"
6,"good, bitterness, come, said, learn, mess"
6,"enthusiasm, thing, around, seems, stigma, false"
6,"whether, relationship, viewed, affected, stranger, opinion"
6,"never, even, always, lesson, tell, thing"
6,"supposed, amongst, message, telling, loud, woman"
6,"eagerness, culture, unbothered, ambivalence, around, outlook"
6,"never, family, would, ive, thank, ever"
6,"good, take, never, always, life, ive"
6,"bos, type, email, different, thesis, send"
6,"enthusiasm, thing, hiding, advocate, seems, big"
6,"sure, im, becausе, main, rеason, 90"
6,"face, helped, get, looking, people, knowing"
6,"undercut, try, way, going, people, along"
6,"true, finding, im, really, isnt, time"
6,"face, helped, get, looking, people, back"
6,"energy, also, take, magnesium, health, muscle"
6,"magical, yeah, oh, miserable, tonight, way"
6,"never, family, would, ive, life, ever"
6,"eagerness, culture, seems, around, stigma, false"
6,"whether, relationship, viewed, consensus, internet, general"
6,"never, even, someone, tell, im, say"
6,"eagerness, culture, unbothered, ambivalence, around, stigma"
6,"whether, relationship, viewed, affected, internet, general"
6,"rodriguez, matos, felix, hockfield, susan, humble"
6,"dorm, college, global, locked, pandemic, nyu"
6,"advice, give, unless, want, anyone, tell"
6,"december, 2015, australia, adelaide, 10th, 8th"
6,"never, hammered, heavy, something, life, ive"
6,"never, hammered, heavy, life, blow, ive"
6,"could, would, speak, fear, happen, choose"
6,"remember, people, write, 25, asking, gon na"
6,"never, opinion, stock, changed, there, whether"
6,"remember, people, lesson, real, want, love"
6,"december, 2015, australia, 11th, 10th, melbourne"
6,"could, would, help, situation, know, nice"
6,"guilty, rock, let, eat, guilt, hit"
6,"october, 2015, usa, florida, 31st, miami"
6,"could, someone, happen, speak, fear, else"
6,"could, someone, happen, speak, fear, choose"
6,"october, 2015, usa, arlington, dakota, 17th"
6,"knocked, never, blow, ive, heavy, hammered"
6,"could, someone, happen, lesson, choose, fear"
6,"october, 2015, usa, florida, 31st, tampa"
6,"certificate, 30, year, part, weird, turn"
6,"never, hammered, dont, ive, something, life"
6,"good, thing, life, lose, love, dont"
6,"october, 2015, usa, north, carolina, 8th"
6,"good, thing, come, want, one, give"
6,"october, 2015, usa, north, carolina, 9th"
6,"october, 2015, usa, kentucky, greensboro, 21st"
6,"4, hating, learned, stop, lesson, searching"
6,"front, cobra, appeared, onstage, karyn, named"
6,"guilty, feel, right, eat, let, guilt"
6,"never, childhood, working, scar, example, rectifying"
6,"certificate, 30, year, birth, learned, lyricsaccording"
6,"certificate, 30, year, birth, turn, lyricsaccording"
6,"remember, people, lesson, real, 25, problem"
6,"guilty, feel, hit, let, eat, guilt"
6,"never, rectifying, popular, scar, working, example"
6,"october, 2015, usa, atlanta, carolina, 24th"
6,"could, would, speak, fear, feel, one"
6,"could, would, speak, fear, happen, else"
6,"certificate, 30, year, birth, turn, weird"
6,"could, someone, see, look, telling, unwittingly"
6,"knocked, never, blow, foot, smile, got"
6,"never, note, always, take, people, around"
6,"october, 2015, usa, 27th, florida, miami"
6,"december, 2015, australia, adelaide, 7th, brisbane"
6,"genre, country, might, folk, alternative, pop"
6,"genre, country, switched, ive, process, pop"
6,"genre, country, switched, ive, process, album"
6,"genre, country, switched, ive, alternative, pop"
6,"december, 2015, australia, sydney, chinaoceanianovember, 28th"
6,"genre, country, switched, folk, alternative, pop"
6,"probably, youre, rising, mean, time, might"
6,"tension, person, wind, coming, conversation, argument"
6,"tension, person, there, coming, conversation, argument"
6,"sending, loud, society, constantly, ive, learned"
6,"sending, loud, society, constantly, message, woman"
6,"probably, youre, youll, fine, forget, learned"
6,"sending, loud, society, constantly, message, learned"
6,"evermore, folklore, three, album, instead, making"
6,"probably, youre, forget, searching, fine, learned"
6,"evermore, folklore, one, instead, unique, making"
6,"december, 2015, australia, adelaide, 7th, 8th"
6,"4, hating, learned, stop, lesson, every"
6,"could, day, lesson, love, much, feel"
6,"october, 2015, usaasia, 31st, tampa, florida"
6,"october, 2015, usa, 27th, georgia, miami"
6,"october, 2015, usa, omaha, nebraska, 10th"
6,"october, 2015, usa, omaha, nebraska, 9th"
6,"could, someone, speak, one, fear, feel"
6,"could, someone, speak, one, fear, choose"
6,"good, thing, life, lose, love, every"
6,"could, someone, fear, lesson, feel, one"
6,"could, someone, fear, lesson, feel, dont"
6,"could, someone, fear, lesson, one, choose"
6,"could, someone, love, u, make, much"
6,"could, someone, love, u, make, thing"
6,"could, someone, love, every, ever, tell"
6,"could, made, day, austin, sacrifice, every"
6,"good, thing, life, give, want, one"
6,"remember, right, want, thank, love, prove"
6,"october, 2015, usa, omaha, iowa, 9th"
6,"december, 2015, australia, adelaide, melbourne, 10th"
6,"remember, right, want, thank, love, u"
6,"could, would, u, much, make, love"
6,"4, hating, learned, stop, ounce, every"
6,"guilty, feel, right, make, take, step"
6,"could, today, one, u, would, know"
6,"could, today, one, u, would, ever"
6,"beautiful, much, thank, honor, amazingembed, brit"
6,"beautiful, much, thank, honor, wrong, love"
6,"beautiful, much, thank, prove, wrong, love"
6,"worked, hating, fat, body, every, ounce"
6,"could, survive, ever, knowing, satisfaction, get"
6,"darkest, answer, okay, life, disappear, however"
6,"11, ive, released, made, album, process"
6,"11, ive, released, made, album, long"
6,"11, ive, released, made, place, long"
6,"11, ive, released, switched, album, process"
6,"could, foot, person, feel, tell, dont"
6,"remember, people, u, love, thank, ever"
6,"good, thing, come, want, learn, ive"
6,"never, little, always, lesson, tell, mom"
6,"wouldnt, chic, people, know, fundamentally, lot"
6,"could, today, one, u, thing, know"
6,"26, excited, thing, make, im, time"
6,"could, today, one, feel, would, know"
6,"sad, sometimes, forever, relationship, outgrow, grow"
6,"never, incredible, many, take, granted, appreciating"
6,"never, incredible, many, take, granted, new"
6,"magnesium, take, also, anxiety, stress, muscle"
6,"magnesium, take, also, anxiety, stress, help"
6,"who, taylor, ew, swift, anyway, seems"
6,"who, taylor, ew, swift, anyway, uhuh"
6,"magnesium, take, also, anxiety, health, muscle"
6,"dorm, essentially, pandemic, locked, global, class"
6,"who, one, ew, seems, swift, anyway"
6,"boost, fight, one, couple, know, ego"
6,"boost, fight, one, couple, know, thick"
6,"sad, sometimes, may, outgrow, grow, relationship"
6,"sad, sometimes, forever, phase, comrade, important"
6,"sad, sometimes, forever, phase, grow, outgrow"
6,"sad, sometimes, forever, phase, grow, important"
6,"worked, ounce, hard, fat, body, every"
6,"dorm, essentially, pandemic, locked, global, nyu"
6,"sad, theyll, phase, comrade, important, forever"
6,"good, thing, make, love, lose, every"
6,"could, knowing, get, people, lesson, thing"
6,"26, excited, thing, make, im, countdown"
6,"could, get, lol, apology, would, nice"
6,"martin, deserved, producer, max, thank, coexecutive"
6,"guilty, feel, right, make, let, step"
6,"imaginary, reading, male, college, meet, model"
6,"could, would, lesson, happen, fear, else"
6,"could, would, lesson, happen, fear, choose"
6,"could, would, lesson, situation, nice, know"
6,"could, would, lesson, feel, fear, one"
6,"imaginary, fantasy, model, male, college, meet"
6,"4, youre, searching, lesson, learned, fine"
6,"imaginary, fantasy, story, love, song, college"
6,"could, would, lesson, nice, 15, know"
6,"imaginary, fantasy, story, love, song, video"
6,"imaginary, fantasy, story, love, meet, college"
6,"could, would, lesson, choose, one, fear"
6,"imaginary, fantasy, story, male, college, meet"
6,"guilty, feel, right, make, let, guilt"
6,"remember, people, ever, asking, write, gon na"
6,"head, im, meant, one, u, burned"
6,"4, youre, searching, lesson, learned, stop"
6,"could, get, people, u, would, apology"
6,"26, really, lesson, inspiration, time, cool"
6,"good, witnessed, faith, world, love, ive"
6,"head, im, sure, pretty, internet, would"
6,"martin, want, producer, thank, max, year"
6,"martin, want, producer, thank, max, coexecutive"
6,"remember, people, lesson, asking, problem, 25"
6,"head, im, sure, pretty, internet, fahrenheit"
6,"head, im, celsius, sure, pretty, fahrenheit"
6,"martin, deserved, producer, max, 25, year"
6,"4, honor, brit, thank, amazingembed, contributors2022"
6,"martin, deserved, producer, max, 25, coexecutive"
6,"could, get, people, nice, apology, bully"
6,"could, get, people, nice, apology, would"
6,"remember, people, u, love, thank, want"
6,"martin, deserved, producer, max, thank, year"
6,"4, honor, brit, thank, amazingembed, beautiful"
6,"remember, people, lesson, gon na, asking, 25"
6,"never, exactly, life, know, opinion, family"
6,"advice, give, unless, unsolicited, anyone, ask"
6,"genre, 11, album, switched, process, ive"
6,"lighter, room, there, one, anyway, toxic"
6,"japan, tokyo, may, japannorth, 2015, 6th"
6,"japan, tokyo, may, japannorth, 2015, onemay"
6,"sit, sometimes, thing, right, reform, progress"
6,"sit, sometimes, thing, right, reform, listen"
6,"good, thing, two, make, sight, lose"
6,"dorm, college, global, locked, pandemic, class"
6,"good, thing, theyre, look, even, big"
6,"sit, one, know, get, u, thing"
6,"energy, lesson, life, someone, much, take"
6,"good, well, always, never, searching, intensely"
6,"never, granted, stop, take, many, appreciating"
6,"ever, happy, get, there, common, write"
6,"advice, interviewer, executive, medium, industry, music"
6,"indianapolis, september, indiana, usa, 2015, 16th"
6,"never, one, thing, whether, feel, ive"
6,"ever, happy, get, there, common, misconception"
6,"advice, interviewer, executive, medium, industry, often"
6,"sit, one, know, get, u, would"
6,"sit, one, know, get, room, thing"
6,"sit, one, know, get, room, would"
6,"july, 2015, usa, chicago, illinois, 19th"
6,"never, brain, still, intensely, searching, developing"
6,"advice, person, people, life, someone, room"
6,"never, brain, still, intensely, rapid, developing"
6,"energy, lesson, life, drama, much, room"
6,"ever, would, today, word, incredible, enough"
6,"ever, would, incredible, parent, enough, family"
6,"ever, would, incredible, parent, enough, word"
6,"ever, would, u, people, thank, love"
6,"ever, would, u, people, get, write"
6,"never, destination, supposed, thing, word, know"
6,"sit, song, room, write, would, alone"
6,"sit, song, room, write, would, get"
6,"never, written, songwriter, ive, sit, able"
6,"ever, would, ive, felt, people, life"
6,"never, written, songwriter, ive, recorded, anything"
6,"never, written, songwriter, ive, recorded, able"
6,"never, one, thing, trying, listen, im"
6,"never, one, thing, know, listen, sit"
6,"advice, interviewer, executive, medium, presented, often"
6,"sit, felt, would, alone, write, room"
6,"whose, exactly, never, opinion, changed, whether"
6,"never, one, youve, someone, say, know"
6,"whose, exactly, never, thank, family, know"
6,"sit, felt, would, alone, lonely, hopelessly"
6,"ever, member, incredible, parent, enough, family"
6,"roster, home, way, cry, car, made"
6,"follower, million, invoking, racism, provoking, 114"
6,"enrichment, say, let, new, educational, today"
6,"enrichment, say, let, new, educational, welcome"
6,"follower, million, invoking, racism, provoking, fear"
6,"whose, stock, opinion, changed, never, whether"
6,"lead, choice, path, know, next, hard"
6,"advice, give, rule, try, unsolicited, anyone"
6,"rodriguez, matos, world, way, improve, humble"
6,"rodriguez, matos, felix, hockfield, susan, honoree"
6,"energy, lesson, jump, 16, headfirst, maybe"
6,"advice, give, unless, want, anyone, try"
6,"whose, exactly, never, opinion, changed, know"
6,"ever, would, today, word, standing, enough"
6,"good, take, learn, twenty, especially, risk"
6,"follower, million, invoking, enough, speak, 114"
6,"whose, exactly, never, opinion, family, know"
6,"sit, felt, would, alone, lonely, room"
6,"never, one, thing, know, thought, back"
6,"energy, lesson, jump, 16, headfirst, health"
6,"never, one, would, college, thought, love"
6,"never, one, would, youve, know, say"
6,"never, one, would, ive, whether, feel"
6,"never, one, forget, lesson, around, stuck"
6,"advice, give, life, wont, tell, however"
6,"never, one, forget, lesson, get, know"
6,"advice, give, life, dont, however, tell"
6,"ever, perfectly, —, didnt, one, maybe"
6,"advice, give, life, room, people, someone"
6,"ever, maybe, u, —, one, arent"
6,"good, take, learn, twenty, especially, life"
6,"never, one, youve, someone, say, tell"
6,"follower, million, informed, speak, enough, 114"
6,"advice, give, life, many, people, room"
6,"ever, would, jail, star, around, forever"
6,"advice, person, price, unsolicited, year, youngest"
6,"advice, ever, dont, said, earlier, offer"
6,"wall, thing, id, hung, way, along"
6,"sitting, lunch, table, alone, flashback, hiding"
6,"sitting, lunch, adult, flashback, recurring, still"
6,"worker, tonight, done, youve, thank, everything"
6,"never, much, someone, youve, dont, say"
6,"probably, youre, something, promise, right, wearing"
6,"probably, youre, something, mean, met, resistance"
6,"men, lesson, required, remotely, 7, even"
6,"men, lesson, required, remotely, isnt, even"
6,"probably, youre, something, mean, new, resistance"
6,"men, lesson, required, fear, 7, biggest"
6,"never, much, someone, lesson, even, im"
6,"men, youth, isnt, required, even, remotely"
6,"cleveland, 6th, june, usa, ohio, 2015"
6,"worker, tonight, key, youve, thank, everything"
6,"probably, learn, forget, youll, fine, learned"
6,"figuratively, falling, person, wrong, choice, trusting"
6,"sitting, lunch, table, alone, bathroom, hiding"
6,"figuratively, falling, person, wrong, face, trusting"
6,"whose, exactly, friend, family, know, opinion"
6,"knocked, never, blow, foot, heavy, hammered"
6,"knocked, never, blow, foot, heavy, got"
6,"wall, would, hole, id, fewer, definitely"
6,"wall, would, hole, id, fewer, hung"
6,"probably, youre, negativity, met, resistance, free"
6,"good, thing, said, come, learn, mess"
6,"good, thing, said, come, moment, mess"
6,"probably, youre, negativity, met, resistance, mean"
6,"never, much, thank, would, youve, say"
6,"never, much, thank, would, youve, love"
6,"men, lesson, manchester, 7, biggest, fear"
6,"remember, right, wrong, love, thank, prove"
6,"remember, prayer, real, lesson, problem, 25"
6,"men, lesson, required, remotely, 7, biggest"
6,"pinned, blue, ’, jail, put, something"
6,"lyricswelcome, costume, spacei, romanticsblank, yorknew, new"
6,"wall, thing, id, hung, fewer, hole"
6,"wall, thing, id, hung, way, hole"
6,"sitting, even, flashback, adult, recurring, still"
6,"evermore, folklore, one, album, instead, making"
6,"energy, lesson, magnesium, health, muscle, 16"
6,"figuratively, falling, person, wrong, face, front"
6,"never, much, would, youve, feel, love"
6,"energy, lesson, muscle, jump, 16, health"
6,"ever, gon na, get, write, happy, asking"
6,"never, much, would, lesson, im, even"
6,"ever, gon na, get, write, happy, there"
6,"july, 2015, usa, chicago, illinois, 18th"
6,"never, much, would, say, im, even"
6,"ever, news, one, get, people, life"
6,"july, 2015, usa, chicago, illinois, 24th"
6,"ever, news, dont, people, get, life"
6,"ever, centered, around, idea, mistake, forever"
6,"ever, centered, around, idea, mistake, equal"
6,"never, much, would, say, im, life"
6,"ever, centered, around, idea, jail, forever"
6,"ever, centered, around, star, jail, forever"
6,"ever, centered, pop, jail, forever, star"
6,"advice, ever, dont, earlier, unless, offer"
6,"ever, gon na, get, write, people, asking"
6,"laser, thing, one, weird, lessen, insecurity"
6,"ever, stalker, get, online, enough, ive"
6,"ever, address, ive, get, online, enough"
6,"july, 2015, usa, jersey, washington, 13th"
6,"july, 2015, usa, foxborough, 25th, massachusetts"
6,"energy, lesson, magnesium, health, muscle, take"
6,"july, 2015, usa, 24th, foxborough, illinois"
6,"whose, exactly, friend, family, know, thank"
6,"never, much, someone, lesson, even, year"
6,"never, much, someone, lesson, even, take"
6,"never, much, someone, say, even, im"
6,"ever, every, someone, life, tell, love"
6,"july, 2015, usa, 24th, foxborough, massachusetts"
6,"ever, every, ive, address, home, post"
6,"ever, every, ive, address, home, online"
6,"ever, every, ive, tell, life, love"
6,"ever, home, get, online, address, ive"
6,"never, much, someone, say, even, year"
6,"never, much, someone, say, dont, year"
6,"ever, anymore, u, maybe, —, arent"
6,"ever, stalker, get, online, enough, trying"
6,"indianapolis, september, indiana, usa, 2015, 17th"
6,"longstanding, embodiment, issue, turn, living, lesson"
6,"mistake, thing, im, lose, cause, trying"
6,"free, youre, thing, yeah, way, best"
6,"114, feel, speak, enough, informed, 30"
6,"114, feel, speak, enough, informed, million"
6,"fed, message, young, make, didnt, adult"
6,"singing, loved, would, didnt, anyone, country"
6,"singing, music, country, loved, didnt, anyone"
6,"girli, get, place, wish, wouldhow, know"
6,"social, video, much, thank, coming, distancing"
6,"social, noise, 1, learned, block, lesson"
6,"usa, 2015, september, 9th, houston, colorado"
6,"usa, 2015, september, denver, 9th, colorado"
6,"forget, time, tonight, heartbreak, night, ohoh"
6,"forget, maybe, lesson, get, dont, know"
6,"forget, learned, lesson, get, dont, youre"
6,"forget, searching, lesson, fine, youre, learned"
6,"take, come, need, know, moment, right"
6,"forget, one, back, youre, get, know"
6,"take, wrongdoing, step, right, feel, make"
6,"take, wrongdoing, step, right, deny, make"
6,"take, lesson, work, way, know, people"
6,"take, lesson, around, learn, ive, learned"
6,"take, natural, feel, better, much, ltheanine"
6,"take, right, try, time, know, life"
6,"take, right, feel, make, much, someone"
6,"take, right, feel, step, someone, make"
6,"take, right, feel, really, know, someone"
6,"take, right, feel, really, make, someone"
6,"take, right, feel, really, make, time"
6,"take, need, path, know, time, life"
6,"take, need, stand, life, time, path"
6,"take, need, stand, life, time, right"
6,"take, need, feel, also, someone, look"
6,"take, need, feel, moment, know, people"
6,"take, wrongdoing, step, right, deny, moment"
6,"take, wrongdoing, step, right, feel, moment"
6,"forget, one, lesson, get, youre, learned"
6,"forget, one, lesson, get, youre, know"
6,"forget, one, lesson, get, maybe, know"
6,"next, anyone, want, try, im, world"
6,"album, ive, made, one, long, released"
6,"album, ive, made, thank, people, world"
6,"album, ive, say, want, people, one"
6,"woman, arent, u, happen, tell, message"
6,"woman, amongst, message, reason, telling, loud"
6,"choice, cool, people, scary, wont, many"
6,"choice, moment, know, right, youre, come"
6,"choice, moment, know, right, youre, wont"
6,"choice, moment, know, right, need, come"
6,"choice, moment, know, people, wont, many"
6,"choice, moment, know, people, wont, youre"
6,"choice, life, know, youre, love, right"
6,"choice, life, know, youre, wont, right"
6,"choice, life, know, youre, wont, people"
6,"next, every, lesson, year, coming, learned"
6,"next, rinse, better, try, time, caused"
6,"next, give, lesson, learned, want, dont"
6,"next, learned, lesson, 29, coming, year"
6,"obsessed, female, idea, young, perfect, role"
6,"obsessed, female, idea, young, perfect, absolutely"
6,"worse, even, id, couldnt, lock, room"
6,"worse, even, id, punish, would, misbehaving"
6,"next, know, year, lesson, dont, want"
6,"next, know, im, dont, try, want"
6,"next, know, im, dont, try, time"
6,"take, lesson, work, way, know, really"
6,"next, know, im, world, try, want"
6,"next, make, take, better, try, time"
6,"next, make, take, better, try, help"
6,"next, make, take, better, lesson, time"
6,"next, make, im, better, try, time"
6,"next, make, im, better, try, help"
6,"next, learned, lesson, take, make, better"
6,"next, learned, lesson, year, dont, want"
6,"next, know, ended, changed, three, world"
6,"take, lesson, make, learned, really, someone"
6,"take, lesson, make, learned, learn, ive"
6,"take, lesson, make, feel, someone, much"
6,"amazing, many, everything, youve, weve, done"
6,"contributor2021, brit, 1, award, icon, global"
6,"different, thing, every, meant, rail, person"
6,"different, thing, every, meant, said, person"
6,"different, thing, one, wont, youre, know"
6,"different, thing, one, person, youre, know"
6,"different, thing, one, person, meant, rail"
6,"different, thing, one, person, meant, said"
6,"different, thing, one, person, tell, youre"
6,"different, thing, one, really, u, know"
6,"support, even, help, much, got, needed"
6,"support, even, help, much, got, someone"
6,"support, even, help, much, music, needed"
6,"excellent, knowledge, sound, wine, type, know"
6,"excellent, knowledge, gave, know, wine, type"
6,"amazing, weve, love, youve, done, everything"
6,"amazing, thank, love, everything, youve, done"
6,"jameela, feel, jamil, subject, reading, word"
6,"lot, taking, u, boundary, push, dieting"
6,"year, say, want, really, someone, even"
6,"saying, one, know, want, say, would"
6,"bottom, let, eat, rock, guilt, hit"
6,"car, cry, made, id, way, home"
6,"wasnt, told, didnt, time, chosen, included"
6,"incredible, would, honor, proud, really, im"
6,"incredible, mentor, parent, member, enough, family"
6,"excellent, knowledge, gave, career, type, losing"
6,"chameleon, think, idea, continuation, fascinating, —"
6,"meant, thing, one, hurt, im, u"
6,"meant, thing, ’, hurt, u, dont"
6,"lot, took, system, political, time, educating"
6,"lot, thing, lose, love, ’, tell"
6,"lot, thing, 2, get, lesson, time"
6,"lot, thing, gain, time, lose, losing"
6,"lot, push, think, u, dieting, boundary"
6,"meant, thing, dont, hurt, im, u"
6,"choice, life, know, many, wont, people"
6,"excellent, knowledge, gave, career, type, wine"
6,"dance, way, love, laugh, make, drive"
6,"take, ltheanine, feel, much, make, better"
6,"take, look, life, learn, ive, learned"
6,"take, look, around, learn, ive, learned"
6,"take, also, look, someone, way, feel"
6,"take, help, better, make, much, ltheanine"
6,"take, lesson, know, feel, really, time"
6,"take, lesson, life, learn, ive, learned"
6,"take, lesson, life, learn, ive, time"
6,"take, lesson, life, feel, better, time"
6,"take, lesson, life, feel, better, much"
6,"take, lesson, make, learn, ive, time"
6,"take, lesson, make, feel, time, really"
6,"take, lesson, make, feel, twenty, way"
6,"take, lesson, make, feel, ive, time"
6,"take, lesson, make, feel, better, time"
6,"take, try, time, ive, know, life"
6,"led, thing, best, way, youre, life"
6,"led, thing, know, people, u, way"
6,"led, thing, know, people, life, many"
6,"currently, people, 29, ive, heard, age"
6,"currently, people, 29, ive, heard, say"
6,"currently, people, 29, ive, feel, age"
6,"heavy, blow, whoa, ive, life, hammered"
6,"post, home, way, cry, id, car"
6,"book, single, model, reading, one, grass"
6,"memory, amazing, youve, weve, done, many"
6,"excellent, knowledge, gave, career, nearly, losing"
6,"memory, amazing, inn, many, 15, last"
6,"memory, amazing, inn, many, weve, last"
6,"memory, amazing, inn, year, last, 15"
6,"memory, playing, inn, last, 15, year"
6,"point, someone, really, even, year, help"
6,"block, learned, 1, caring, noise, lesson"
6,"block, learned, 1, sharing, lesson, caring"
6,"led, thing, know, people, life, ive"
6,"memory, amazing, inn, many, weve, done"
6,"choice, life, know, need, love, right"
