Dimensão,Clique
7,"verbalize, lesson, want, love, feel, real, really"
7,"verbalize, lesson, want, love, feel, real, life"
7,"verbalize, lesson, want, love, feel, someone, really"
7,"verbalize, lesson, want, love, feel, someone, life"
7,"editing, idea, end, polishing, waking, middle, night"
7,"editing, idea, end, polishing, waking, middle, narrowing"
7,"go, thing, good, get, dont, sometimes, let"
7,"go, thing, good, get, dont, sometimes, want"
7,"go, thing, good, get, dont, sometimes, look"
7,"around, want, lesson, ive, would, people, one"
7,"around, want, lesson, ive, thing, learn, learned"
7,"around, want, lesson, ive, thing, one, learned"
7,"around, want, lesson, ive, thing, one, people"
7,"go, thing, tell, hole, feel, im, way"
7,"game, life, sport, lose, single, spectator, every"
7,"go, thing, tell, hole, feel, im, need"
7,"hurt, one, someone, love, arent, u, tell"
7,"hurt, one, someone, love, arent, u, people"
7,"hurt, one, someone, sorry, want, u, im"
7,"go, thing, tell, still, love, want, youre"
7,"go, thing, tell, dont, let, afterglow, youre"
7,"go, thing, hold, let, run, right, time"
7,"go, thing, hold, let, oftentimes, good, rest"
7,"go, thing, always, life, get, good, perspective"
7,"go, thing, always, still, way, tell, never"
7,"go, would, know, say, want, im, life"
7,"stand, life, time, back, actually, right, thing"
7,"stand, life, time, need, thing, actually, right"
7,"go, demoralizing, victim, assault, sexual, trial, know"
7,"go, coffeehouse, singing, day, could, standing, today"
7,"go, thing, every, lesson, time, tell, life"
7,"go, thing, every, lesson, love, could, day"
7,"go, thing, every, lesson, love, could, tell"
7,"go, thing, every, lesson, love, could, make"
7,"go, thing, every, lesson, love, could, thought"
7,"hurt, dont, im, someone, want, sorry, u"
7,"go, thing, every, lesson, love, way, make"
7,"thought, thing, know, dont, love, oh, ’"
7,"thought, thing, know, dont, love, ’, u"
7,"go, thing, might, way, today, feel, im"
7,"go, thing, might, way, got, ’, look"
7,"go, thing, might, time, youre, tell, life"
7,"go, thing, 27, lesson, better, always, learned"
7,"go, thing, always, thought, lesson, never, dont"
7,"go, thing, always, thought, lesson, learned, better"
7,"thought, thing, know, dont, back, oh, ’"
7,"go, thing, always, thought, lesson, learned, dont"
7,"unintentional, easy, apologize, even, say, try, move"
7,"go, thing, tell, dont, afterglow, ’, youre"
7,"go, thing, know, get, act, figuring, time"
7,"go, thing, know, get, act, figuring, want"
7,"better, vitamin, lesson, 15, feel, much, make"
7,"better, one, thing, lesson, learned, life, im"
7,"better, one, thing, lesson, learned, life, get"
7,"go, thing, know, feel, im, today, let"
7,"better, one, thing, lesson, feel, im, life"
7,"go, thing, know, going, im, love, way"
7,"go, thing, know, going, im, love, want"
7,"go, thing, know, sexual, lesson, coming, assault"
7,"year, lesson, feel, someone, dont, want, know"
7,"year, lesson, feel, someone, really, know, want"
7,"go, thing, know, feel, im, today, way"
7,"go, thing, made, feel, today, could, day"
7,"go, thing, learned, lesson, im, better, make"
7,"go, thing, learned, lesson, im, better, life"
7,"year, right, really, want, know, last, thank"
7,"year, right, really, want, know, feel, someone"
7,"go, thing, learned, lesson, im, let, make"
7,"go, thing, learned, lesson, im, let, dont"
7,"year, u, want, really, someone, right, know"
7,"year, u, want, really, thank, right, know"
7,"go, thing, learned, look, dont, life, im"
7,"go, thing, make, feel, lesson, could, love"
7,"game, playing, real, lesson, mind, chase, 19"
7,"go, would, know, say, want, im, really"
7,"go, thing, know, feel, right, sometimes, look"
7,"still, thing, oh, youre, yeah, way, love"
7,"go, thing, know, get, going, youre, time"
7,"go, thing, know, ’, got, way, look"
7,"go, thing, know, ’, dont, love, thought"
7,"go, thing, know, victim, trial, sexual, assault"
7,"go, thing, know, youre, right, sometimes, want"
7,"go, thing, know, youre, right, sometimes, look"
7,"go, thing, know, youre, right, life, time"
7,"go, thing, know, feel, day, lesson, let"
7,"go, thing, know, feel, day, today, could"
7,"go, thing, know, feel, day, today, let"
7,"still, thing, oh, youre, might, innocent, 1"
7,"still, thing, one, feel, back, people, want"
7,"still, thing, one, feel, need, moment, people"
7,"still, thing, one, youre, back, people, want"
7,"still, thing, one, youre, love, might, tell"
7,"still, thing, one, youre, love, might, people"
7,"still, thing, one, youre, love, want, tell"
7,"still, thing, one, youre, love, want, people"
7,"still, thing, one, youre, moment, people, back"
7,"still, thing, way, love, people, youre, might"
7,"still, thing, way, love, feel, might, people"
7,"still, thing, oh, youre, yeah, innocent, 1"
7,"still, thing, one, feel, back, people, moment"
7,"go, thing, make, feel, right, really, time"
7,"go, would, know, say, want, get, life"
7,"go, would, know, say, never, life, get"
7,"ive, make, im, lesson, thing, time, feel"
7,"ive, make, im, lesson, thing, id, learned"
7,"device, tie, together, there, reason, one, plot"
7,"go, low, wan na, meet, see, excruciating, afterglow"
7,"go, wan na, see, afterglow, dont, let, excruciating"
7,"likely, sometimes, read, internet, anyway, thing, hard"
7,"go, wan na, see, afterglow, dont, let, youre"
7,"ive, made, thing, look, feel, people, one"
7,"go, wan na, say, would, im, life, know"
7,"go, wan na, say, dont, let, know, im"
7,"go, wan na, say, dont, let, know, youre"
7,"go, wan na, say, dont, let, afterglow, youre"
7,"go, foot, never, dont, could, feel, tell"
7,"convey, lesson, never, could, impression, first, thing"
7,"go, see, dont, youre, ’, way, look"
7,"go, see, dont, youre, lesson, let, time"
7,"enviable, school, promotion, ex, thing, grudge, update"
7,"go, star, would, pop, jail, forever, ever"
7,"go, totally, dont, news, get, good, want"
7,"go, totally, dont, news, terrifying, good, want"
7,"go, ho, die, hole, im, tell, need"
7,"ive, make, im, lesson, thing, time, learn"
7,"ive, make, im, try, thing, love, want"
7,"go, fault, tell, say, need, im, want"
7,"apologize, try, im, even, easy, say, move"
7,"go, lip, girl, list, smile, every, thought"
7,"ive, life, time, thing, lesson, every, tell"
7,"ive, life, say, want, im, learn, world"
7,"ive, life, say, look, im, learn, world"
7,"ive, life, learned, thing, look, im, learn"
7,"ive, life, learned, thing, look, im, one"
7,"ive, life, learned, thing, look, im, dont"
7,"ive, life, love, learn, im, world, look"
7,"ive, life, love, learn, im, world, want"
7,"ive, life, love, learn, im, thing, look"
7,"go, baby, mystery, smile, surrender, got, girl"
7,"ive, life, love, every, thing, lesson, tell"
7,"go, lip, girl, list, smile, every, way"
7,"go, morning, im, need, tell, ho, hole"
7,"go, completely, time, know, feel, lesson, life"
7,"ive, thank, know, would, want, people, love"
7,"ive, thank, know, would, want, people, say"
7,"la, 2015, vega, nevada, may, usa, 20th"
7,"ive, thank, know, thing, want, people, love"
7,"go, completely, time, know, terrified, didnt, tour"
7,"ive, thank, know, world, want, people, love"
7,"ive, thank, know, world, want, people, say"
7,"ive, life, love, know, place, get, one"
7,"chess, real, lesson, verbalize, feel, life, want"
7,"navigating, career, life, dream, starting, knew, love"
7,"navigating, career, life, dream, starting, knew, wish"
7,"high, school, date, friend, people, one, wanted"
7,"go, laugh, love, way, dont, get, look"
7,"theyre, thing, im, even, someone, need, look"
7,"go, would, singing, today, standing, coffeehouse, could"
7,"theyre, thing, im, one, someone, need, look"
7,"go, would, singing, today, standing, coffeehouse, word"
7,"go, would, coffeehouse, ever, today, standing, could"
7,"theyre, thing, people, someone, need, one, look"
7,"go, would, coffeehouse, ever, today, standing, word"
7,"go, would, always, never, lesson, get, life"
7,"high, school, date, friend, people, one, want"
7,"go, would, ever, could, love, get, never"
7,"forward, thing, im, looking, theyre, even, adding"
7,"forward, thing, im, looking, theyre, even, big"
7,"go, would, make, could, feel, lesson, love"
7,"go, would, make, really, want, right, say"
7,"go, would, make, really, want, im, say"
7,"forward, thing, im, looking, theyre, free, adding"
7,"there, thing, dont, life, look, get, way"
7,"there, thing, dont, life, look, ’, way"
7,"go, would, know, right, want, really, say"
7,"go, would, know, right, want, life, say"
7,"go, would, ever, life, get, never, love"
7,"go, would, know, say, never, life, im"
7,"go, advice, ill, life, tell, dont, ever"
7,"go, advice, ill, unless, unsolicited, ask, anyone"
7,"go, world, im, know, say, life, want"
7,"go, world, im, know, love, life, want"
7,"go, world, right, say, know, life, look"
7,"go, world, right, say, know, life, want"
7,"go, world, right, love, know, life, want"
7,"go, world, right, love, know, life, look"
7,"trying, make, im, lose, thing, feel, love"
7,"go, die, im, hole, feel, tell, need"
7,"go, die, im, might, feel, tell, need"
7,"come, know, one, thing, need, ive, want"
7,"go, advice, ill, life, tell, dont, want"
7,"come, know, one, thing, need, ive, able"
7,"go, next, im, lesson, time, make, better"
7,"go, next, im, lesson, time, know, dont"
7,"go, next, im, lesson, know, want, dont"
7,"go, next, im, lesson, learned, better, make"
7,"go, next, im, lesson, learned, want, make"
7,"go, next, im, lesson, learned, want, dont"
7,"go, advice, ill, unless, tell, anyone, want"
7,"go, advice, ill, unless, tell, dont, ever"
7,"trying, lose, im, tell, thing, love, feel"
7,"go, advice, ill, unless, tell, dont, want"
7,"come, know, one, say, want, need, ive"
7,"away, even, take, someone, really, matter, nothing"
7,"go, thing, make, feel, right, let, time"
7,"game, relationship, real, lesson, chase, mind, friendship"
7,"time, thing, know, room, life, get, lesson"
7,"everyone, time, get, lot, sweet, lesson, 2"
7,"time, thing, know, dont, oh, youre, yeah"
7,"time, thing, know, dont, fight, lesson, youre"
7,"time, thing, know, dont, life, person, feel"
7,"take, lesson, life, feel, time, know, ive"
7,"time, thing, know, dont, life, person, youre"
7,"time, thing, know, dont, life, try, back"
7,"take, lesson, life, feel, twenty, way, people"
7,"time, thing, know, dont, life, back, feel"
7,"time, thing, know, right, need, feel, moment"
7,"time, thing, know, right, back, feel, life"
7,"british, canada, vancouver, columbia, august, 2015, 4th"
7,"take, lesson, make, feel, vitamin, much, better"
7,"british, canada, vancouver, columbia, august, 2015, 1st"
7,"take, lesson, make, feel, someone, way, step"
7,"take, lesson, make, feel, someone, way, really"
7,"time, thing, know, right, back, try, life"
7,"time, thing, know, right, back, youre, fight"
7,"time, thing, know, right, back, youre, moment"
7,"time, thing, know, right, back, youre, life"
7,"time, thing, know, many, life, get, room"
7,"time, thing, tell, dont, life, person, youre"
7,"time, thing, tell, dont, life, person, feel"
7,"take, lesson, know, feel, really, way, someone"
7,"time, everything, feel, im, life, dont, know"
7,"led, thing, know, destination, word, common, u"
7,"lower, ive, feeling, led, people, jumped, board"
7,"time, thing, every, life, tell, lesson, keep"
7,"actual, feel, 283, age, currently, 29, ive"
7,"time, thing, might, tell, oh, fight, youre"
7,"take, look, life, ive, try, people, know"
7,"seeing, dusting, want, still, back, experience, getting"
7,"time, thing, might, tell, life, im, keep"
7,"time, thing, might, also, oh, fight, youre"
7,"time, isnt, lesson, im, feel, know, really"
7,"time, thing, might, also, feel, need, im"
7,"calculate, celsius, im, fahrenheit, head, immediately, learned"
7,"rewarding, mistake, chance, happy, loss, ultimately, failure"
7,"rewarding, mistake, chance, happy, loss, ultimately, life"
7,"rewarding, mistake, chance, happy, loss, experience, life"
7,"time, thing, make, feel, really, lose, im"
7,"time, thing, make, feel, really, back, right"
7,"supported, today, student, pursuit, educational, let, enrichment"
7,"time, thing, tell, dont, oh, fight, youre"
7,"time, thing, tell, dont, fight, lesson, youre"
7,"tried, someone, try, live, best, explain, every"
7,"calculate, celsius, im, fahrenheit, also, immediately, learned"
7,"time, isnt, lesson, im, feel, know, dont"
7,"hand, one, something, saying, happened, raising, come"
7,"take, right, try, someone, know, life, look"
7,"forget, time, tonight, heartbreak, night, oh, yeah"
7,"kansa, september, usa, 2015, missouri, city, 21st"
7,"kansa, september, usa, 2015, missouri, city, 25th"
7,"kansa, september, usa, 2015, missouri, city, 22nd"
7,"right, thing, make, someone, want, back, actually"
7,"right, thing, make, someone, want, back, try"
7,"right, thing, actually, someone, life, back, want"
7,"right, thing, actually, someone, life, back, look"
7,"right, thing, know, want, love, thank, youre"
7,"simple, life, get, joy, many, pick, time"
7,"forget, time, dont, know, youre, oh, yeah"
7,"simple, life, get, joy, many, pick, wonderful"
7,"right, thing, know, want, back, fight, youre"
7,"worse, even, id, punish, would, lock, room"
7,"next, know, im, dont, keep, lesson, want"
7,"next, know, im, dont, keep, lesson, time"
7,"away, even, nothing, apologize, easy, unintentional, move"
7,"right, would, want, say, thank, really, know"
7,"away, even, say, im, need, much, someone"
7,"right, would, want, love, make, really, u"
7,"away, even, say, im, easy, apologize, move"
7,"next, rinse, better, try, time, repeat, im"
7,"right, thing, know, want, love, fight, youre"
7,"led, thing, know, people, life, way, youre"
7,"forget, time, dont, know, youre, oh, back"
7,"forget, time, dont, know, youre, get, back"
7,"kid, many, uhuh, night, place, crowded, cool"
7,"kid, want, u, would, empty, seat, southwest"
7,"kid, always, u, would, seat, southwest, thought"
7,"kid, always, u, would, seat, southwest, empty"
7,"hand, ’, thought, something, pinned, behind, back"
7,"take, right, feel, really, know, moment, time"
7,"hand, oh, back, thought, behind, ’, pinned"
7,"take, need, feel, moment, know, right, time"
7,"take, need, feel, life, know, time, ive"
7,"take, need, feel, life, know, time, right"
7,"forget, time, dont, know, youre, get, lesson"
7,"take, need, feel, life, much, right, someone"
7,"stranger, love, fall, uhuh, night, breakfast, midnight"
7,"myth, trying, effortlessness, one, people, least, wanted"
7,"myth, trying, effortlessness, one, people, ashamed, wanted"
7,"right, thing, give, want, someone, try, life"
7,"social, noise, 1, learned, block, medium, also"
7,"right, thing, make, someone, want, love, try"
7,"wisdom, thing, sometimes, listen, right, know, sit"
7,"forget, time, dont, night, heartbreak, oh, yeah"
7,"right, thing, make, someone, want, love, actually"
7,"forget, time, dont, know, heartbreak, oh, yeah"
7,"take, supplement, help, natural, much, better, ltheanine"
7,"game, relationship, real, lesson, chase, youre, friendship"
7,"time, everything, feel, im, life, dont, lose"
7,"pressure, life, know, completely, feel, pointless, everything"
7,"sharing, lesson, 2019, 30, learned, reaching, ive"
7,"even, im, lesson, really, thing, someone, want"
7,"nothing, dont, ive, something, see, laugh, look"
7,"go, say, afterglow, let, tell, youre, dont"
7,"even, im, lesson, tell, want, thing, someone"
7,"go, say, tell, dont, ’, hey, way"
7,"go, say, tell, dont, im, hey, way"
7,"go, say, tell, dont, im, hey, need"
7,"meant, wan na, u, dont, sorry, hurt, im"
7,"meant, wan na, u, dont, sorry, hurt, ’"
7,"go, say, know, get, going, youre, way"
7,"go, say, know, get, going, youre, want"
7,"go, say, know, ’, dont, way, hey"
7,"go, say, know, right, let, sometimes, youre"
7,"go, say, know, right, look, need, life"
7,"lot, thing, time, lesson, know, get, ive"
7,"go, say, know, right, look, youre, sometimes"
7,"go, say, know, right, look, youre, life"
7,"go, say, know, right, want, sometimes, really"
7,"go, say, know, right, want, sometimes, youre"
7,"lot, thing, want, love, know, ’, u"
7,"sharing, lesson, 2019, 30, learned, reaching, caring"
7,"nothing, dont, ive, something, love, look, laugh"
7,"sharing, lesson, 2019, 30, learned, 1, caring"
7,"nothing, dont, ive, something, love, look, life"
7,"game, relationship, real, lesson, chase, mind, playing"
7,"go, ill, dont, tell, never, could, ever"
7,"go, ill, dont, tell, never, life, say"
7,"go, ill, dont, tell, never, life, ever"
7,"even, ’, tell, break, want, say, need"
7,"go, ill, dont, tell, want, say, life"
7,"go, ill, dont, get, never, could, know"
7,"go, ill, dont, get, never, could, ever"
7,"go, ill, dont, get, never, life, ever"
7,"charlotte, june, usa, 2015, 8th, north, carolina"
7,"lot, thing, want, love, tell, lesson, ive"
7,"even, ’, tell, thing, put, look, might"
7,"year, say, want, really, someone, right, know"
7,"year, say, want, really, thank, right, know"
7,"even, ’, tell, thing, need, might, look"
7,"go, anyone, im, feel, tell, need, want"
7,"go, anyone, im, say, tell, need, look"
7,"go, anyone, im, say, tell, need, want"
7,"til, ’, love, blow, u, break, whyd"
7,"nothing, dont, rose, attitude, thought, something, love"
7,"saying, one, know, want, say, youre, come"
7,"given, one, locale, thing, cooler, moment, youre"
7,"charlotte, june, usa, 2015, 9th, north, carolina"
7,"lot, thing, want, love, tell, ’, u"
7,"lot, thing, room, get, lesson, know, time"
7,"lot, thing, room, get, lesson, know, people"
7,"different, thing, one, day, running, meant, rail"
7,"go, ever, tell, love, dont, never, life"
7,"go, ever, dont, get, love, never, could"
7,"go, ever, dont, get, love, never, life"
7,"go, meet, tell, dont, ’, love, need"
7,"go, meet, tell, dont, ’, love, youre"
7,"go, ooh, need, dont, feel, im, know"
7,"go, hey, dont, time, need, im, tell"
7,"go, hey, dont, time, need, im, know"
7,"even, im, say, want, someone, tell, need"
7,"nothing, dont, ’, there, way, life, look"
7,"nothing, dont, someone, way, look, life, love"
7,"nothing, dont, someone, way, look, laugh, see"
7,"even, im, say, look, someone, tell, need"
7,"nothing, dont, contributorsain ’, go, 8, afterglow66embed, meet"
7,"12th, 2015, usa, north, october, fargo, dakota"
7,"12th, 2015, usa, north, raleigh, june, carolina"
7,"dance, way, love, feel, make, alive, drive"
7,"throwing, idea, old, night, middle, editing, waking"
7,"throwing, idea, end, editing, middle, waking, night"
7,"race, next, coming, big, help, going, im"
7,"lower, ive, feeling, led, people, ever, board"
7,"nothing, dont, someone, way, look, laugh, love"
7,"pressure, life, know, completely, feel, pointless, living"
7,"nothing, dont, ’, tease, way, see, think"
7,"different, thing, one, cause, wont, reason, tell"
7,"go, say, know, right, want, need, life"
7,"go, say, know, right, want, youre, life"
7,"nothing, dont, ’, something, attitude, thought, love"
7,"go, say, know, im, really, sometimes, want"
7,"go, say, know, im, dont, way, hey"
7,"go, say, know, im, dont, sometimes, let"
7,"go, say, know, im, dont, sometimes, want"
7,"go, say, know, im, dont, sometimes, look"
7,"even, im, thing, really, u, someone, want"
7,"even, im, thing, tell, need, someone, want"
7,"go, ever, tell, love, dont, never, could"
7,"even, im, thing, tell, need, someone, look"
7,"go, news, get, dont, life, look, youre"
7,"go, news, get, dont, life, want, good"
7,"even, im, thing, tell, need, might, look"
7,"different, thing, every, meant, rail, running, day"
7,"even, im, thing, tell, u, someone, want"
7,"go, news, get, dont, life, want, youre"
7,"go, order, time, know, get, figuring, act"
7,"nothing, dont, ’, something, way, think, see"
7,"go, order, want, get, act, figuring, know"
7,"different, thing, one, wont, youre, reason, tell"
7,"go, news, get, dont, life, look, good"
7,"like, youre, news, one, life, people, wont"
7,"like, wan na, say, ’, dont, life, lose"
7,"angel, would, perfect, earth, slip, however, entire"
7,"pointless, know, completely, feel, everything, time, life"
7,"far, really, taking, dieting, boundary, push, u"
7,"like, say, youve, would, one, really, know"
7,"today, graduate, york, new, let, celebrate, class"
7,"act, get, thing, figuring, overwhelming, know, time"
7,"like, say, im, make, really, lose, way"
7,"like, say, im, make, really, someone, way"
7,"like, say, im, make, really, someone, want"
7,"like, say, im, make, really, would, want"
7,"act, get, thing, figuring, overwhelming, know, want"
7,"anxiety, take, ltheanine, stress, supplement, help, natural"
7,"anxiety, take, also, supplement, stress, help, natural"
7,"adding, theyre, thing, im, app, free, countdown"
7,"hey, dont, time, need, im, lose, tell"
7,"like, say, im, much, life, someone, dont"
7,"like, say, im, know, really, proud, would"
7,"like, say, im, know, really, someone, way"
7,"hey, dont, say, im, need, lose, tell"
7,"going, people, know, try, thing, love, want"
7,"going, people, know, try, thing, love, way"
7,"hey, dont, say, im, need, break, tell"
7,"hey, dont, say, im, need, break, face"
7,"going, people, along, love, way, try, thing"
7,"like, say, im, know, life, living, look"
7,"hey, dont, say, im, way, lose, tell"
7,"going, youre, put, know, thing, people, love"
7,"sit, one, still, ive, long, place, stay"
7,"sit, one, still, ive, able, place, stay"
7,"hey, dont, say, ’, need, lose, tell"
7,"pointless, know, completely, feel, everything, time, sometimes"
7,"like, seeker, real, approval, isnt, lesson, important"
7,"like, say, youve, someone, dont, done, tell"
7,"like, say, youve, someone, dont, way, know"
7,"never, thank, know, ive, people, love, would"
7,"never, thank, ever, would, love, people, ive"
7,"never, dont, there, get, ever, life, ive"
7,"never, dont, ever, love, could, get, people"
7,"never, dont, ever, love, could, someone, people"
7,"never, dont, ever, love, could, someone, tell"
7,"like, keep, know, im, dont, ooh, say"
7,"never, dont, ever, love, life, someone, people"
7,"never, dont, ever, love, life, someone, tell"
7,"never, dont, ever, love, life, ive, tell"
7,"never, dont, tell, ive, im, life, say"
7,"like, keep, know, im, dont, let, say"
7,"never, dont, know, thing, chic, im, ive"
7,"guess, ’, fantasy, torturer, played, apparently, got"
7,"never, dont, know, say, chic, ive, people"
7,"never, dont, know, say, chic, ive, im"
7,"like, say, youve, proud, really, know, would"
7,"like, say, youve, someone, really, way, know"
7,"never, dont, know, say, ive, life, im"
7,"never, dont, know, something, love, could, people"
7,"never, dont, know, something, love, could, thought"
7,"like, say, youve, someone, really, one, done"
7,"like, say, youve, someone, really, one, know"
7,"like, say, youve, someone, one, tell, done"
7,"like, say, youve, someone, dont, way, tell"
7,"today, one, u, done, alone, patchwork, loved"
7,"never, dont, know, something, love, ive, thought"
7,"never, dont, know, something, back, people, life"
7,"creative, amazing, people, thank, opportunity, love, would"
7,"like, say, youve, someone, dont, done, much"
7,"like, news, got ta, twentytwo, yeah, ooh, night"
7,"like, news, one, ooh, yeah, twentytwo, night"
7,"like, news, dont, ooh, yeah, night, twentytwo"
7,"hey, even, say, need, tell, ’, break"
7,"going, woman, say, try, people, along, way"
7,"october, 2015, usa, lexington, kentucky, 21st, 20th"
7,"hey, one, im, say, need, ooh, know"
7,"going, woman, say, young, people, way, along"
7,"october, 2015, usa, north, carolina, greensboro, 21st"
7,"october, 2015, usa, north, carolina, greensboro, 24th"
7,"hey, thick, fight, say, couple, one, know"
7,"going, get, youre, know, people, say, want"
7,"hey, glastonbury, almost, last, year, played, know"
7,"going, get, youre, know, people, say, way"
7,"26, really, lesson, thing, make, countdown, im"
7,"26, really, lesson, thing, make, countdown, cool"
7,"like, u, know, really, moment, one, thing"
7,"26, really, lesson, thing, make, time, im"
7,"26, really, lesson, thing, make, time, cool"
7,"wouldnt, chic, people, know, fundamentally, try, dont"
7,"university, york, new, today, celebrate, graduate, class"
7,"sometimes, thing, right, someone, know, want, youre"
7,"university, york, new, today, 2022, single, class"
7,"university, york, new, today, 2022, single, done"
7,"university, york, new, today, 2022, graduate, class"
7,"university, york, one, today, single, 2022, class"
7,"university, york, one, today, single, 2022, done"
7,"university, u, today, one, single, 2022, class"
7,"university, u, today, one, single, 2022, done"
7,"moines, 2015, de, october, iowa, usa, 8th"
7,"moines, 2015, de, october, iowa, usa, 9th"
7,"missouri, 2015, usa, october, st, louis, 2nd"
7,"going, woman, thing, people, way, along, young"
7,"october, 2015, usa, 27th, georgia, 24th, atlanta"
7,"hey, even, say, need, tell, ’, lose"
7,"going, woman, thing, people, way, along, try"
7,"going, im, next, try, time, repeat, rinse"
7,"like, got, look, thing, someone, way, know"
7,"like, got, look, thing, someone, way, also"
7,"sit, one, know, listen, thing, u, come"
7,"sit, one, know, get, place, stay, ive"
7,"hey, dont, say, ’, need, break, tell"
7,"hey, dont, say, ’, need, break, face"
7,"like, got, look, thing, someone, one, also"
7,"like, got, look, thing, might, one, also"
7,"like, got, look, everything, way, someone, know"
7,"like, got, look, everything, way, someone, also"
7,"hey, dont, say, ’, way, lose, tell"
7,"sit, one, know, able, ive, place, stay"
7,"sit, one, know, able, ive, come, thing"
7,"never, thank, know, ive, people, love, thing"
7,"hey, dont, forget, heartbreak, time, night, yeah"
7,"hey, dont, forget, heartbreak, time, know, yeah"
7,"hey, dont, forget, heartbreak, time, know, ohoh"
7,"july, 2015, usa, jersey, 13th, rutherford, new"
7,"going, im, thing, know, try, love, want"
7,"laser, thing, beam, turn, weird, lessen, insecurity"
7,"going, im, thing, know, try, love, way"
7,"sitting, lunch, table, alone, flashback, recurring, still"
